id,cluster_thermodynamics,cluster_color_thermodynamics,cluster,cluster_color,Protein,Structure Title,Residues (Length),Dep. Date,Exp_Method,Resolution,Authors,From Patient,Sample origin,Disease,Tissue,Role (P/F/S),BMRB,EMDB,PubMed,UniProt,Organism,Mutation,Modification
12kl,-1,#7f7f7f,0.0,#e55b5b,RIPK3; M45,SSNMR Structure of Anti-necroptosis Viral:Human Functional Hetero-amyloid M45:RIPK3,447-473 (27); 48-75 (28),4/9/26,SOLID-STATE NMR,,"He, C.; Varghese, N.R.; Keeler, E.G.; Pham, C.L.L.; Xie, T.; Williams, B.; Tetter, S.; Semaan, C.; Wilde, K.L.; Brown, S.H.J.; Bouwer, J.C.; Gambin, Y.; Sierecki, E.; Steain, M.; Zhou, R.; Sunde, M.; McDermott, A.E.",,in_vitro,,,F,31301,,42044340.0,Q9Y572; Q06A28,Homo sapiens (Human); Murid herpesvirus 1 (strain Smith) (MuHV-1) (Mouse cytomegalovirus),,
2n0a,-1,#7f7f7f,-1.0,#7f7f7f,a-synuclein,Atomic-resolution structure of alpha-synuclein fibrils,1-140 (140),3/4/15,SOLID-STATE NMR,,"Tuttle, M.D.; Comellas, G.; Nieuwkoop, A.J.; Covell, D.J.; Berthold, D.A.; Kloepper, K.D.; Courtney, J.M.; Kim, J.K.; Barclay, A.M.; Kendall, A.; Wan, W.; Stubbs, G.; Schwieters, C.D.; Lee, V.M.; George, J.M.; Rienstra, C.M.",,in_vitro,,,P,25518,,27018801.0,P37840,Homo sapiens (Human),,
5w3n,-1,#7f7f7f,3.0,#e5985b,FUS,Molecular structure of FUS low sequence complexity domain protein fibrils,37-97 (61),6/8/17,SOLID-STATE NMR,,"Murray, D.T.; Kato, M.; Lin, Y.; Thurber, K.R.; Hung, I.; McKnight, S.L.; Tycko, R.",,in_vitro,,,P,30304,,28942918.0,P35637,Homo sapiens (Human),,
6lni,-1,#7f7f7f,-1.0,#7f7f7f,PrP,Cryo-EM structure of amyloid fibril formed by full-length human prion protein,170-229 (60),12/30/19,ELECTRON MICROSCOPY,2.7,"Wang, L.Q.; Zhao, K.; Yuan, H.Y.; Wang, Q.; Guan, Z.; Tao, J.; Li, X.N.; Sun, Y.; Yi, C.W.; Chen, J.; Li, D.; Zhang, D.; Yin, P.; Liu, C.; Liang, Y.",,in_vitro,,,P,,EMD-0931,32514176.0,P04156,Homo sapiens (Human),,
6mst,-1,#7f7f7f,-1.0,#7f7f7f,SAA,Cryo-EM structure of human AA amyloid fibril,20-73 (54),10/18/18,ELECTRON MICROSCOPY,2.7,"Liberta, F.; Loerch, S.; Rennegarbe, M.; Schierhorn, A.; Westermark, P.; Westermark, G.T.; Hazenberg, B.P.C.; Grigorieff, N.; Fandrich, M.; Schmidt, M.",√,human_ex_vivo,AA amyloidosis,human kidney,P,,EMD-9232,30846696.0,P0DJI8,Homo sapiens (Human),,
6r4r,-1,#7f7f7f,-1.0,#7f7f7f,Phosphatidylinositol 3-kinase regulatory subunit alpha,Cryo-EM Structure of the PI3-Kinase SH3 Domain Amyloid Fibril,1-77 (77),3/23/19,ELECTRON MICROSCOPY,3.4,"Roder, C.; Vettore, N.; Mangels, L.N.; Gremer, L.; Ravelli, R.B.G.; Willbold, D.; Hoyer, W.; Buell, A.K.; Schroder, G.F.",,in_vitro,,,S,,EMD-4727,31434882.0,P23727,Bos taurus (Bovine),,
6uur,-1,#7f7f7f,0.0,#e55b5b,PrP,"Human prion protein fibril, M129 variant",106-145 (40),10/31/19,ELECTRON MICROSCOPY,3.5,"Glynn, C.; Sawaya, M.R.; Ge, P.; Gallagher-Jones, M.; Short, C.W.; Bowman, R.; Apostol, M.; Zhou, Z.H.; Eisenberg, D.S.; Rodriguez, J.A.",,in_vitro,,,P,,EMD-20900,32284600.0,P04156,Homo sapiens (Human),,
6xfm,-1,#7f7f7f,0.0,#e55b5b,FUS,Molecular structure of the core of amyloid-like fibrils formed by residues 111-214 of FUS,112-150 (39),6/15/20,ELECTRON MICROSCOPY,2.62,"Lee, M.; Ghosh, U.; Thurber, K.R.; Kato, M.; Tycko, R.",,in_vitro,,,P,,EMD-22169,33184287.0,P35637,Homo sapiens (Human),,
7da4,-1,#7f7f7f,0.0,#e55b5b,RIPK3,Cryo-EM structure of amyloid fibril formed by human RIPK3,448-469 (22),10/14/20,ELECTRON MICROSCOPY,4.24,"Wu, X.; Ma, Y.; Zhao, K.; Zhang, J.; Sun, Y.; Li, Y.; Dong, X.; Hu, H.; Liu, J.; Wang, J.; Zhang, X.; Li, B.; Wang, H.; Li, D.; Sun, B.; Lu, J.; Liu, C.",,in_vitro,,,F,,EMD-30622,33790016.0,Q9Y572,Homo sapiens (Human),,
7dwv,-1,#7f7f7f,0.0,#e55b5b,PrP,Cryo-EM structure of amyloid fibril formed by familial prion disease-related mutation E196K,175-217 (43),1/18/21,ELECTRON MICROSCOPY,3.07,"Wang, L.Q.; Zhao, K.; Yuan, H.Y.; Li, X.N.; Dang, H.B.; Ma, Y.; Wang, Q.; Wang, C.; Sun, Y.; Chen, J.; Li, D.; Zhang, D.; Yin, P.; Liu, C.; Liang, Y.",,in_vitro,,,P,,EMD-30887,34516876.0,P04156,Homo sapiens (Human),E196K,
7kwz,-1,#7f7f7f,-1.0,#7f7f7f,TDP43,TDP-43 LCD amyloid fibrils,276-414 (139),12/2/20,ELECTRON MICROSCOPY,3.2,"Li, Q.; Babinchak, W.M.; Surewicz, W.K.",,in_vitro,,,P,,EMD-23059,33712624.0,Q13148,Homo sapiens (Human),,
7py2,-1,#7f7f7f,-1.0,#7f7f7f,TDP43,Structure of pathological TDP-43 filaments from ALS with FTLD,282-360 (79),10/8/21,ELECTRON MICROSCOPY,2.59,"Arseni, D.; Hasegawa, M.; Murzin, A.G.; Kametani, F.; Arai, M.; Yoshida, M.; Ryskeldi-Falcon, B.",√,human_ex_vivo,ALS with FTLD,human frontal cortex,P,,EMD-13708,34880495.0,Q13148,Homo sapiens (Human),,
7q67,-1,#7f7f7f,0.0,#e55b5b,Nup98,Cryo-em structure of the Nup98 fibril polymorph 4,90-122 (33),11/5/21,ELECTRON MICROSCOPY,3.37,"Ibanez de Opakua, A.; Geraets, J.A.; Frieg, B.; Dienemann, C.; Savastano, A.; Rankovic, M.; Cima-Omori, M.S.; Schroder, G.F.; Zweckstetter, M.",,in_vitro,,,F,,EMD-13854,36138110.0,P52948,Homo sapiens (Human),,
7qkh,-1,#7f7f7f,4.0,#e5ac5b,Tau,"In vitro assembled 258-391 tau filaments with sodium azide, (41a)",277-310 (34); 284-317 (34),12/17/21,ELECTRON MICROSCOPY,3.17,"Lovestam, S.; Koh, F.A.; van Knippenberg, B.; Kotecha, A.; Murzin, A.G.; Goedert, M.; Scheres, S.H.W.",,in_vitro,,,P,,EMD-14042,35244536.0,P10636,Homo sapiens (Human),,
7qky,-1,#7f7f7f,-1.0,#7f7f7f,Tau,In vitro assembled 0N4R tau filaments with phosphoserine (47a),376-441 (66),12/19/21,ELECTRON MICROSCOPY,1.86,"Lovestam, S.; Koh, F.A.; van Knippenberg, B.; Kotecha, A.; Murzin, A.G.; Goedert, M.; Scheres, S.H.W.",,in_vitro,,,P,,EMD-14057,35244536.0,P10636,Homo sapiens (Human),,
7sp1,-1,#7f7f7f,-1.0,#7f7f7f,Tau,RNA-induced tau amyloid fibril,391-426 (36),11/2/21,ELECTRON MICROSCOPY,3.4,"Abskharon, R.; Sawaya, M.R.; Boyer, D.R.; Cao, Q.; Nguyen, B.A.; Cascio, D.; Eisenberg, D.S.",,in_vitro,,,P,,EMD-25364,35377792.0,P10636,Homo sapiens (Human),,
7vqq,-1,#7f7f7f,5.0,#e5c05b,FUS,Cryo-EM structure of amyloid fibril formed by FUS low complexity domain,34-124 (91),10/20/21,ELECTRON MICROSCOPY,2.9,"Sun, Y.; Zhang, S.; Hu, J.; Tao, Y.; Xia, W.; Gu, J.; Li, Y.; Cao, Q.; Li, D.; Liu, C.",,in_vitro,,,P,,EMD-32092,35036880.0,P35637,Homo sapiens (Human),,
7vzf,-1,#7f7f7f,-1.0,#7f7f7f,SOD1,Cryo-EM structure of amyloid fibril formed by full-length human SOD1,4-56; 87-154 (121),11/16/21,ELECTRON MICROSCOPY,2.95,"Wang, L.Q.; Ma, Y.; Yuan, H.Y.; Zhao, K.; Zhang, M.Y.; Wang, Q.; Huang, X.; Xu, W.C.; Dai, B.; Chen, J.; Li, D.; Zhang, D.; Wang, Z.; Zou, L.; Yin, P.; Liu, C.; Liang, Y.",,in_vitro,,,P,,EMD-32227,35715417.0,P00441,Homo sapiens (Human),,
7yat,-1,#7f7f7f,0.0,#e55b5b,PrP,CryoEM tetra protofilament structure of the hamster prion 108-144 fibril,119-143 (25),6/28/22,ELECTRON MICROSCOPY,2.2,"Chen, E.H.; Kao, H.W.; Lee, C.H.; Huang, J.Y.C.; Wu, K.P.; Chen, R.P.",,in_vitro,,,P,,EMD-33719,35857020.0,P04273,Mesocricetus auratus (Golden hamster),,
7zh7,-1,#7f7f7f,-1.0,#7f7f7f,SAA,Cryo-EM structure of ex vivo AA amyloid from renal tissue of a short hair cat deceased in a shelter,19-94 (76),4/5/22,ELECTRON MICROSCOPY,3.3,"Schulte, T.; Chaves-Sanjuan, A.; Mazzini, G.; Speranzini, V.; Lavatelli, F.; Ferri, F.; Palizzotto, C.; Mazza, M.; Milani, P.; Nuvolone, M.; Vogt, A.C.; Vogel, M.; Palladini, G.; Merlini, G.; Bolognesi, M.; Ferro, S.; Zini, E.; Ricagno, S.",,animal_ex_vivo,,cat kidney,P,,EMD-14726,36396658.0,Q1T770,Felis catus (Cat),,
7zir,-1,#7f7f7f,-1.0,#7f7f7f,Heterogeneous nuclear ribonucleoprotein D-like,Cryo-EM structure of hnRNPDL amyloid fibrils,345-395 (51),4/8/22,ELECTRON MICROSCOPY,2.5,"Garcia-Pardo, J.; Bartolome-Nafria, A.; Chaves-Sanjuan, A.; Gil-Garcia, M.; Visentin, C.; Bolognesi, M.; Ricagno, S.; Ventura, S.",,in_vitro,,,F,,EMD-14738,36646699.0,O14979,Homo sapiens (Human),,
8fpt,-1,#7f7f7f,-1.0,#7f7f7f,a-synuclein,STRUCTURE OF ALPHA-SYNUCLEIN FIBRILS DERIVED FROM HUMAN LEWY BODY DEMENTIA TISSUE,30-103 (74),1/5/23,SOLID-STATE NMR,,"Dhavale, D.D.; Barclay, A.M.; Borcik, C.G.; Basore, K.; Berthold, D.A.; Gordon, I.R.; Liu, J.; Milchberg, M.H.; O'Shea, J.Y.; Rau, M.J.; Smith, Z.; Sen, S.; Summers, B.; Smith, J.; Warmuth, O.A.; Perrin, R.J.; Perlmutter, J.S.; Chen, Q.; Fitzpatrick, J.A.J.; Schwieters, C.D.; Tajkhorshid, E.; Rienstra, C.M.; Kotzbauer, P.T.",,seeded_amplified,,Amplified from LBD postmortem human caudate,P,51678;31068,,38553463.0,P37840,Homo sapiens (Human),,
8g2v,-1,#7f7f7f,-1.0,#7f7f7f,LECT2,Cryo-EM structure of recombinant human LECT2 amyloid fibril core,55-75 (21),2/6/23,ELECTRON MICROSCOPY,2.71,"Richards, L.S.; Flores, M.D.; Zink, S.; Schibrowsky, N.A.; Sawaya, M.R.; Rodriguez, J.A.",,in_vitro,,,P,,EMD-29682,37657439.0,O14960,Homo sapiens (Human),,
8g55,-1,#7f7f7f,-1.0,#7f7f7f,Tau,Temperature-dependent structures of tau aggregates,264-326 (63),2/11/23,SOLID-STATE NMR,,"El Mammeri, N.; Duan, P.; Dregni, A.J.; Hong, M.",,in_vitro,,,P,31075,,37450599.0,P10636,Homo sapiens (Human),,
8jey,-1,#7f7f7f,-1.0,#7f7f7f,a-synuclein,Cryo-EM structure of alpha-synuclein pS87 fibril,1-72 (72),5/16/23,ELECTRON MICROSCOPY,2.6,"Hu, J.; Xia, W.; Zeng, S.; Lim, Y.J.; Tao, Y.; Sun, Y.; Zhao, L.; Wang, H.; Le, W.; Li, D.; Zhang, S.; Liu, C.; Li, Y.M.",,in_vitro,,,P,,EMD-36203,38538591.0,P37840,Homo sapiens (Human),,pS87
8qut,-1,#7f7f7f,-1.0,#7f7f7f,Lysozyme,Cryo-EM structure of the heat-irreversible amyloid fibrils of human lysozyme,22-34; 50-128 (92),10/17/23,ELECTRON MICROSCOPY,2.8,"Frey, L.; Zhou, J.; Cereghetti, G.; Weber, M.E.; Rhyner, D.; Pokharna, A.; Wenchel, L.; Kadavath, H.; Cao, Y.; Meier, B.H.; Peter, M.; Greenwald, J.; Riek, R.; Mezzenga, R.",,in_vitro,,,P,,EMD-18663,39349464.0,P61626,Homo sapiens (Human),,
8r4a,-1,#7f7f7f,-1.0,#7f7f7f,Lysozyme,Cryo-EM structure of the D87G lysozyme amyloid fibril,1-130 (130),11/13/23,ELECTRON MICROSCOPY,2.8,"Karimi-Farsijani, S.; Sharma, K.; Ugrina, M.; Kuhn, L.; Pfeiffer, P.B.; Haupt, C.; Wiese, S.; Hegenbart, U.; Schonland, S.O.; Schwierz, N.; Schmidt, M.; Fandrich, M.",√,human_ex_vivo,hereditary lysozyme amyloidosis,human abdominal fat tissue,P,,EMD-18883,39511224.0,P61626,Homo sapiens (Human),D87G,
8rvt,-1,#7f7f7f,0.0,#e55b5b,Insulin,Structure of full-length human insulin fibrils,25-45 (21); 90-110 (21),2/2/24,SOLID-STATE NMR,,"Suladze, S.; Sarkar, R.; Rodina, N.; Bokvist, K.; Krewinkel, M.; Scheps, D.; Nagel, N.; Bardiaux, B.; Reif, B.",,in_vitro,,,P,51867,,38809711.0,P01308,Homo sapiens (Human),,
8spa,-1,#7f7f7f,3.0,#e5985b,CPEB3,"Structural insights into cellular control of the human CPEB3 prion, functionally regulated by a labile-amyloid-forming segment",103-151 (49),5/2/23,ELECTRON MICROSCOPY,3.0,"Flores, M.D.; Sawaya, M.R.; Boyer, D.R.; Zink, S.; Tovmasyan, S.; Saucedo, A.; Richards, L.S.; Zee, C.T.; Cardenas, J.; Fioriti, L.; Rodriguez, J.A.",,in_vitro,,,F,,EMD-40677,40480223.0,Q8NE35,Homo sapiens (Human),,
8ter,-1,#7f7f7f,0.0,#e55b5b,TFG,"Tropomyosin-receptor kinase fused gene protein (TRK-fused gene protein; TFG) Low Complexity Domain (residues 237-327) P285L mutant, amyloid fiber",265-299 (35),7/6/23,ELECTRON MICROSCOPY,2.59,"Rosenberg, G.M.; Abskharon, R.; Boyer, D.R.; Ge, P.; Sawaya, M.R.; Eisenberg, D.S.",,in_vitro,,,P,,EMD-41198,38077690.0,Q92734,Homo sapiens (Human),P285L,
8wzx,-1,#7f7f7f,0.0,#e55b5b,PrP,Cryo-EM structure of the hamster prion 23-144 fibril at pH 3.7,94-144 (51),11/2/23,ELECTRON MICROSCOPY,2.88,"Lee, C.H.; Saw, J.E.; Chen, E.H.; Wang, C.H.; Uchihashi, T.; Chen, R.P.",,in_vitro,,,P,,EMD-37963,38641239.0,P04273,Mesocricetus auratus (Golden hamster),,
9atw,-1,#7f7f7f,4.0,#e5ac5b,Phenol-soluble modulin alpha 1 peptide,Structure of biofilm-forming functional amyloid PSMa1 from Staphylococcus aureus,1-21 (21),2/27/24,ELECTRON MICROSCOPY,3.5,"Hansen, K.H.; Byeon, C.H.; Liu, Q.; Drace, T.; Boesen, T.; Conway, J.F.; Andreasen, M.; Akbey, U.",,in_vitro,,,F,,EMD-43835,39116134.0,P0C7Y1,Staphylococcus aureus (strain NCTC 8325 / PS 47),,
9cz3,-1,#7f7f7f,4.0,#e5ac5b,synthetic_amyloid_003,Self assembled nanotube of L5,1-6 (6),8/3/24,ELECTRON MICROSCOPY,2.7,"Das, A.; Gnewou, O.; Zuo, X.; Wang, F.; Conticello, V.P.",,in_vitro,,,S,,EMD-46060,40376775.0,,,,
9gkf,-1,#7f7f7f,3.0,#e5985b,HnRNPA1,Amyloid Fibril of Heterogeneous nuclear ribonucleoprotein A1A induced by RNA binding,293-349 (57),8/23/24,ELECTRON MICROSCOPY,3.21,"Frey, L.; Riek, R.P.",,in_vitro,,,P,,EMD-51419,,P09651,Homo sapiens (Human),,
9hr6,-1,#7f7f7f,0.0,#e55b5b,RIPK1,cryoEM structure of amyloid fibrils formed by human RIPK1,528-551 (24),12/17/24,ELECTRON MICROSCOPY,2.57,"Polonio, P.; Lopez-Alonso, J.P.; Jiang, H.; Andres-Campos, S.; Escobedo-Gonzalez, F.C.; Titaux-Delgado, G.A.; Ubarretxena-Belandia, I.; Mompean, M.",,in_vitro,,,F,,EMD-52356,41168207.0,Q13546,Homo sapiens (Human),,
9iah,-1,#7f7f7f,0.0,#e55b5b,beta-lactoglobulin,Structure of beta-lactoglobulin fibril,17-50 (34),2/10/25,ELECTRON MICROSCOPY,3.17,"Sternke-Hoffmann, R.; Rhyner, D.; Terashi, G.; Qureshi, B.M.; Riek, R.; Greenwald, J.; Kihara, D.; Lutz-Bueno, V.; Luo, J.",,in_vitro,,,F,,EMD-52781,41129746.0,P02754,Bos taurus (Bovine),,
9jbp,-1,#7f7f7f,-1.0,#7f7f7f,SOD1,Cryo-EM structure of human SOD1 (C6A/C111A) amyloid filament,2-42 (41),8/27/24,ELECTRON MICROSCOPY,3.18,"Baek, Y.; Kim, H.; Lee, D.; Kim, D.; Jo, E.; Roh, S.H.; Ha, N.C.",,in_vitro,,,P,,EMD-61322,39874287.0,P00441,Homo sapiens (Human),C6A,C111A
9ktz,-1,#7f7f7f,4.0,#e5ac5b,TIA1,"Cryo-EM structure of the TIA-1 prion-like domain amyloid fibril, G355R",334-349 (16),12/3/24,ELECTRON MICROSCOPY,3.1,"Inaoka, D.; Miyata, T.; Makino, F.; Ohtani, Y.; Ekari, M.; Kobayashi, R.; Imamura, K.; Sakamoto, E.; Kodama, S.T.; Yoshida, N.; Kato, T.; Namba, K.; Tochio, H.; Sekiyama, N.",,in_vitro,,,P,,EMD-62571,,P31483,Homo sapiens (Human),G355R,
9non,-1,#7f7f7f,-1.0,#7f7f7f,LECT2,Cryo-EM structure of amyloid fibril isolated from the kidney of a variant Alect2-I40V amyloidosis patient,1-133 (133),3/10/25,ELECTRON MICROSCOPY,2.4,"Afrin, S.; Nguyen, B.A.; Singh, V.; Singh, P.; Bassett, P.; Pekala, M.; Evers, B.; Lopez, C.; Ahmed, Y.; Li, L.; Kallem, R.R.; Lemoff, A.; Argyropoulos, C.; Kluve-Beckerman, B.; Saelices, L.",√,human_ex_vivo,ALECT2 amyloidosis,human kidney,P,,EMD-49601,41965342.0,O14960,Homo sapiens (Human),I40V,
9o8e,-1,#7f7f7f,-1.0,#7f7f7f,Tau,amyloid fibril of recombinant full-length 2N4R tau complexed with unfractionated mouse liver RNA and seeded by Alzheimer's disease tau fibrils,341-449 (109),4/15/25,ELECTRON MICROSCOPY,3.1,"Abskharon, R.; Jiang, Y.X.; Sawaya, M.R.; Ge, P.; Zhang, J.; Boyer, D.R.; Dolinsky, J.L.; Pi, J.; Cascio, D.; Guo, F.; Eisenberg, D.S.",,seeded_amplified,AD patient brain (left temporal lobe),Seeded,P,,EMD-70224,42006351.0,P10636,Homo sapiens (Human),,
9qlu,-1,#7f7f7f,-1.0,#7f7f7f,17kDa alpha-amylase/trypsin inhibitor 2,Amyloid structure of 17kDa alpha-amylase/trypsin inhibitor 2 (Uniprot ID: AI172_ORYSJ),90-155 (66),3/21/25,ELECTRON MICROSCOPY,2.54,"Rhyner, D.; Frey, L.; Zhou, J.; Kwiatkowski, W.; Mezzenga, R.; Riek, R.; Greenwald, J.",,in_vitro,,,F,,EMD-53234,41123416.0,Q7X8H9,Oryza sativa subsp. japonica (Rice),,
9r2h,-1,#7f7f7f,-1.0,#7f7f7f,Tau,Tau filaments seeded by AD homogenate using 0N3R C322S,316-434 (119),4/30/25,ELECTRON MICROSCOPY,2.6,"Santambrogio, A.; Lovestam, S.; Metrick the Second, M.A.; Lohr, T.; Xu, P.; Gallagher, N.C.T.; Ghetti, B.; Caughey, B.; Scheres, S.H.W.; Vendruscolo, M.",,seeded_amplified,AD brain homogenate (frontal cortex),Seeded,P,,EMD-53530,41026859.0,P10636,Homo sapiens (Human),C322S,
9u4l,-1,#7f7f7f,-1.0,#7f7f7f,a-crystallin A,Fibril structure of human alphaA-crystallin with pathogenic mutation R116C,21-89 (69),3/19/25,ELECTRON MICROSCOPY,3.7,"Song, M.; Han, J.; Cao, Q.",,in_vitro,,,P,,EMD-63849,40770067.0,P02489,Homo sapiens (Human),,R116C
9v45,-1,#7f7f7f,4.0,#e5ac5b,Glycinin G4,Soy storage protein fibril (glycinin A) PM1,164-190 (27),5/22/25,ELECTRON MICROSCOPY,3.41,"Li, S.; Li, S.; Cheng, Y.; Fang, Y.; Cao, Q.; Cao, Y.",,in_vitro,,,F,,EMD-64767,40883254.0,P02858,Glycine max (Soybean),,
9v4f,-1,#7f7f7f,0.0,#e55b5b,Glycinin G4,Soy storage protein fibril (glycinin A) PM2,146-171 (26),5/23/25,ELECTRON MICROSCOPY,3.52,"Li, S.; Li, S.; Cheng, Y.; Fang, Y.; Cao, Q.; Cao, Y.",,in_vitro,,,F,,EMD-64778,40883254.0,P02858,Glycine max (Soybean),,
9xbk,-1,#7f7f7f,-1.0,#7f7f7f,Sup35,Cryo-EM structure of Sup35NM S17R fibril formed at 4 degrees (S17R4N),4-38; 108-115 (43),10/24/25,ELECTRON MICROSCOPY,2.4,"Tanaka, M.; Nomura, T.; Boyer, D.; Komi, Y.; Ge, P.; Maillard, R.A.; Rodriguez, P.; Yamagata, A.; Shirouzu, M.; Legname, G.; Samori, B.; Eisenberg, D.",,in_vitro,,,F,,EMD-66703,41282265.0,P05453,Saccharomyces cerevisiae (strain ATCC 204508 / S288c) (Baker's yeast),S17R,
9xbl,-1,#7f7f7f,3.0,#e5985b,Sup35,Cryo-EM structure of Sup35NM S17R fibril formed at 37 degrees (S17R37N),7-62 (56),10/24/25,ELECTRON MICROSCOPY,2.4,"Tanaka, M.; Nomura, T.; Boyer, D.; Komi, Y.; Ge, P.; Maillard, R.A.; Rodriguez, P.; Yamagata, A.; Shirouzu, M.; Legname, G.; Samori, B.; Eisenberg, D.",,in_vitro,,,F,,EMD-66704,41282265.0,P05453,Saccharomyces cerevisiae (strain ATCC 204508 / S288c) (Baker's yeast),S17R,
9xbm,-1,#7f7f7f,3.0,#e5985b,Sup35,Cryo-EM structure of Sup35NM S17R fibril formed at 37 degrees (S17R37C),69-133 (65),10/24/25,ELECTRON MICROSCOPY,2.4,"Tanaka, M.; Nomura, T.; Boyer, D.; Komi, Y.; Ge, P.; Maillard, R.A.; Rodriguez, P.; Yamagata, A.; Shirouzu, M.; Legname, G.; Samori, B.; Eisenberg, D.",,in_vitro,,,F,,EMD-66705,41282265.0,P05453,Saccharomyces cerevisiae (strain ATCC 204508 / S288c) (Baker's yeast),,S17R
9xbo,-1,#7f7f7f,-1.0,#7f7f7f,Sup35,Cryo-EM structure of Sup35NM fibril formed at 37 degrees (Sc37),5-65; 102-132 (92),10/24/25,ELECTRON MICROSCOPY,3.1,"Tanaka, M.; Nomura, T.; Boyer, D.; Komi, Y.; Ge, P.; Maillard, R.A.; Rodriguez, P.; Yamagata, A.; Shirouzu, M.; Legname, G.; Samori, B.; Eisenberg, D.",,in_vitro,,,F,,EMD-66707,41282265.0,P05453,Saccharomyces cerevisiae (strain ATCC 204508 / S288c) (Baker's yeast),,
9xbp,-1,#7f7f7f,-1.0,#7f7f7f,Sup35,Cryo-EM structure of Sup35NM S17R fibril formed at 4 degrees (S17R4C),87-129; 217-229 (56),10/24/25,ELECTRON MICROSCOPY,2.2,"Tanaka, M.; Nomura, T.; Boyer, D.; Komi, Y.; Ge, P.; Maillard, R.A.; Rodriguez, P.; Yamagata, A.; Shirouzu, M.; Legname, G.; Samori, B.; Eisenberg, D.",,in_vitro,,,F,,EMD-66708,41282265.0,P05453,Saccharomyces cerevisiae (strain ATCC 204508 / S288c) (Baker's yeast),,S17R
10ij,0,#e55b5b,18.0,#5be5b3,Tau,S305I Frontotemporal Lobar Degeneration (FTLD) type I tau filament,273-379 (107),1/21/26,ELECTRON MICROSCOPY,3.1,"Pan, H.S.; Merz, G.E.; Li, A.N.; Le, M.Q.; Jo, H.; Quddus, A.; Yung, A.; Kormos, R.C.; Melo, A.A.; Ramos, E.M.; Lago, A.L.; Spina, S.; Grinberg, L.T.; Rosen, H.J.; Tse, E.; Gorno-Tempini, M.L.; DeGrado, W.F.; Seeley, W.W.; Southworth, D.R.",√,human_ex_vivo,frontotemporal lobar degeneration,human inferior frontal gyrus,P,,EMD-75195,41726928.0,P10636,Homo sapiens (Human),S305I,
10ik,0,#e55b5b,18.0,#5be5b3,Tau,S305I Frontotemporal Lobar Degeneration (FTLD) type II tau filament,273-379 (107),1/21/26,ELECTRON MICROSCOPY,3.2,"Pan, H.S.; Merz, G.E.; Li, A.N.; Le, M.Q.; Jo, H.; Quddus, A.; Yung, A.; Kormos, R.C.; Melo, A.A.; Ramos, E.M.; Lago, A.L.; Spina, S.; Grinberg, L.T.; Rosen, H.J.; Tse, E.; Gorno-Tempini, M.L.; DeGrado, W.F.; Seeley, W.W.; Southworth, D.R.",√,human_ex_vivo,frontotemporal lobar degeneration,human inferior frontal gyrus,P,,EMD-75196,41726928.0,P10636,Homo sapiens (Human),S305I,
6gx5,0,#e55b5b,14.0,#5be562,Tau,Narrow Pick Filament from Pick's disease brain,254-274; 306-378 (94),6/26/18,ELECTRON MICROSCOPY,3.2,"Falcon, B.; Zhang, W.; Murzin, A.G.; Murshudov, G.; Garringer, H.J.; Vidal, R.; Crowther, R.A.; Ghetti, B.; Scheres, S.H.W.; Goedert, M.",√,human_ex_vivo,Pick's disease,human frontotemporal cortex,P,,EMD-0077,30158706.0,P10636,Homo sapiens (Human),,
6tjo,0,#e55b5b,8.0,#cde55b,Tau,Cryo-EM structure of TypeI tau filaments extracted from the brains of individuals with Corticobasal degeneration,274-380 (107),11/26/19,ELECTRON MICROSCOPY,3.2,"Zhang, W.; Tarutani, A.; Newell, K.L.; Murzin, A.G.; Matsubara, T.; Falcon, B.; Vidal, R.; Garringer, H.J.; Shi, Y.; Ikeuchi, T.; Murayama, S.; Ghetti, B.; Hasegawa, M.; Goedert, M.; Scheres, S.H.W.",√,human_ex_vivo,Corticobasal degeneration,human frontal cortex,P,,EMD-10512,32050258.0,P10636,Homo sapiens (Human),,
6tjx,0,#e55b5b,8.0,#cde55b,Tau,Cryo-EM structure of TypeII tau filaments extracted from the brains of individuals with Corticobasal degeneration,274-380 (107),11/27/19,ELECTRON MICROSCOPY,3.0,"Zhang, W.; Tarutani, A.; Newell, K.L.; Murzin, A.G.; Matsubara, T.; Falcon, B.; Vidal, R.; Garringer, H.J.; Shi, Y.; Ikeuchi, T.; Murayama, S.; Ghetti, B.; Hasegawa, M.; Goedert, M.; Scheres, S.H.W.",√,human_ex_vivo,Corticobasal degeneration,human frontal cortex,P,,EMD-10514,32050258.0,P10636,Homo sapiens (Human),,
6vh7,0,#e55b5b,8.0,#cde55b,Tau,Doublet Tau Fibril from Corticobasal Degeneration Human Brain Tissue,274-380 (107),1/9/20,ELECTRON MICROSCOPY,3.8,"Arakhamia, T.; Lee, C.E.; Carlomagno, Y.; Duong, D.M.; Kundinger, S.R.; Wang, K.; Williams, D.; DeTure, M.; Dickson, D.W.; Cook, C.N.; Seyfried, N.T.; Petrucelli, L.; Fitzpatrick, A.W.P.",√,human_ex_vivo,corticobasal degeneration,human medial frontal cortex,P,,EMD-21200,32032505.0,P10636,Homo sapiens (Human),,
6vha,0,#e55b5b,8.0,#cde55b,Tau,Singlet Tau Fibril from Corticobasal Degeneration Human Brain Tissue,274-380 (107),1/9/20,ELECTRON MICROSCOPY,4.3,"Arakhamia, T.; Lee, C.E.; Carlomagno, Y.; Duong, D.M.; Kundinger, S.R.; Wang, K.; Williams, D.; DeTure, M.; Dickson, D.W.; Cook, C.N.; Seyfried, N.T.; Petrucelli, L.; Fitzpatrick, A.W.P.",√,human_ex_vivo,corticobasal degeneration,human brain (medial frontal cortex),P,,EMD-21201,32032505.0,P10636,Homo sapiens (Human),,
7p65,0,#e55b5b,11.0,#91e55b,Tau,Progressive supranuclear palsy tau filament,272-381 (110),7/15/21,ELECTRON MICROSCOPY,2.7,"Shi, Y.; Zhang, W.; Yang, Y.; Murzin, A.G.; Falcon, B.; Kotecha, A.; van Beers, M.; Tarutani, A.; Kametani, F.; Garringer, H.J.; Vidal, R.; Hallinan, G.I.; Lashley, T.; Saito, Y.; Murayama, S.; Yoshida, M.; Tanaka, H.; Kakita, A.; Ikeuchi, T.; Robinson, A.C.; Mann, D.M.A.; Kovacs, G.G.; Revesz, T.; Ghetti, B.; Hasegawa, M.; Goedert, M.; Scheres, S.H.W.",√,human_ex_vivo,progressive supranuclear palsy,human frontal cortex,P,,EMD-13218,34588692.0,P10636,Homo sapiens (Human),,
7p66,0,#e55b5b,11.0,#91e55b,Tau,Globular glial tauopathy type 1 tau filament,272-379 (108),7/15/21,ELECTRON MICROSCOPY,3.0,"Shi, Y.; Zhang, W.; Yang, Y.; Murzin, A.G.; Falcon, B.; Kotecha, A.; van Beers, M.; Tarutani, A.; Kametani, F.; Garringer, H.J.; Vidal, R.; Hallinan, G.I.; Lashley, T.; Saito, Y.; Murayama, S.; Yoshida, M.; Tanaka, H.; Kakita, A.; Ikeuchi, T.; Robinson, A.C.; Mann, D.M.A.; Kovacs, G.G.; Revesz, T.; Ghetti, B.; Hasegawa, M.; Goedert, M.; Scheres, S.H.W.",√,human_ex_vivo,globular glial tauopathy,human frontal cortex,P,,EMD-13219,34588692.0,P10636,Homo sapiens (Human),,
7p67,0,#e55b5b,11.0,#91e55b,Tau,Globular glial tauopathy type 2 tau filament,272-379 (108),7/15/21,ELECTRON MICROSCOPY,3.1,"Shi, Y.; Zhang, W.; Yang, Y.; Murzin, A.G.; Falcon, B.; Kotecha, A.; van Beers, M.; Tarutani, A.; Kametani, F.; Garringer, H.J.; Vidal, R.; Hallinan, G.I.; Lashley, T.; Saito, Y.; Murayama, S.; Yoshida, M.; Tanaka, H.; Kakita, A.; Ikeuchi, T.; Robinson, A.C.; Mann, D.M.A.; Kovacs, G.G.; Revesz, T.; Ghetti, B.; Hasegawa, M.; Goedert, M.; Scheres, S.H.W.",√,human_ex_vivo,globular glial tauopathy,human frontal cortex,P,,EMD-13220,34588692.0,P10636,Homo sapiens (Human),,
7p68,0,#e55b5b,11.0,#91e55b,Tau,Globular glial tauopathy type 3 tau filament,272-379 (108),7/15/21,ELECTRON MICROSCOPY,2.9,"Shi, Y.; Zhang, W.; Yang, Y.; Murzin, A.G.; Falcon, B.; Kotecha, A.; van Beers, M.; Tarutani, A.; Kametani, F.; Garringer, H.J.; Vidal, R.; Hallinan, G.I.; Lashley, T.; Saito, Y.; Murayama, S.; Yoshida, M.; Tanaka, H.; Kakita, A.; Ikeuchi, T.; Robinson, A.C.; Mann, D.M.A.; Kovacs, G.G.; Revesz, T.; Ghetti, B.; Hasegawa, M.; Goedert, M.; Scheres, S.H.W.",√,human_ex_vivo,globular glial tauopathy,human frontal cortex,P,,EMD-13221,34588692.0,P10636,Homo sapiens (Human),,
7p6a,0,#e55b5b,11.0,#91e55b,Tau,Limbic-predominant neuronal inclusion body 4R tauopathy type 1a tau filament,272-379 (108),7/15/21,ELECTRON MICROSCOPY,1.9,"Shi, Y.; Zhang, W.; Yang, Y.; Murzin, A.G.; Falcon, B.; Kotecha, A.; van Beers, M.; Tarutani, A.; Kametani, F.; Garringer, H.J.; Vidal, R.; Hallinan, G.I.; Lashley, T.; Saito, Y.; Murayama, S.; Yoshida, M.; Tanaka, H.; Kakita, A.; Ikeuchi, T.; Robinson, A.C.; Mann, D.M.A.; Kovacs, G.G.; Revesz, T.; Ghetti, B.; Hasegawa, M.; Goedert, M.; Scheres, S.H.W.",√,human_ex_vivo,Limbic-predominant neuronal inclusion body 4R tauopathy,human temporal cortex,P,,EMD-13223,34588692.0,P10636,Homo sapiens (Human),,
7p6b,0,#e55b5b,11.0,#91e55b,Tau,Limbic-predominant neuronal inclusion body 4R tauopathy type 1b tau filament,272-379 (108),7/15/21,ELECTRON MICROSCOPY,2.2,"Shi, Y.; Zhang, W.; Yang, Y.; Murzin, A.G.; Falcon, B.; Kotecha, A.; van Beers, M.; Tarutani, A.; Kametani, F.; Garringer, H.J.; Vidal, R.; Hallinan, G.I.; Lashley, T.; Saito, Y.; Murayama, S.; Yoshida, M.; Tanaka, H.; Kakita, A.; Ikeuchi, T.; Robinson, A.C.; Mann, D.M.A.; Kovacs, G.G.; Revesz, T.; Ghetti, B.; Hasegawa, M.; Goedert, M.; Scheres, S.H.W.",√,human_ex_vivo,Limbic-predominant neuronal inclusion body 4R tauopathy,human temporal cortex,P,,EMD-13224,34588692.0,P10636,Homo sapiens (Human),,
