id,cluster_thermodynamics,cluster_color_thermodynamics,cluster,cluster_color,Protein,Structure Title,Residues (Length),Dep. Date,Exp_Method,Resolution,Authors,From Patient,Sample origin,Disease,Tissue,Role (P/F/S),BMRB,EMDB,PubMed,UniProt,Organism,Mutation,Modification
8ppo,5,#e5cb5b,4.0,#e5ac5b,Tau,First Intermediate Amyloid (FIA) - Tau,302-316 (15),7/7/23,ELECTRON MICROSCOPY,2.0,"Lovestam, S.; Li, D.; Wagstaff, J.L.; Kotecha, A.; Kimanius, D.; McLaughlin, S.H.; Murzin, A.G.; Freund, S.M.V.; Goedert, M.; Scheres, S.H.W.",,in_vitro,,,P,,EMD-17806,38030728.0,P10636,Homo sapiens (Human),,
8qj1,5,#e5cb5b,-1.0,#7f7f7f,IAPP,"Cryo-EM structure of human islet amyloid polypeptide (hIAPP) mutant A25P, polymorph 1",2-37 (36),9/12/23,ELECTRON MICROSCOPY,3.06,"Ooi, S.A.; Valli, D.; Kuska, M.I.; Mari, H.; Chaudhary, H.; Wahlgren, W.Y.; Westenhoff, S.; Tietze, A.A.; Novials, A.; Servitja, J.M.; Maj, M.",,in_vitro,,,P,,EMD-18441,40850490.0,P10997,Homo sapiens (Human),A25P,
8qvp,5,#e5cb5b,0.0,#e55b5b,IAPP,"Cryo-EM structure of human islet amyloid polypeptide (hIAPP) mutant S29P, polymorph 1",8-37 (30),11/2/23,ELECTRON MICROSCOPY,3.75,"Ooi, S.A.; Valli, D.; Kuska, M.I.; Mari, H.; Chaudhary, H.; Wahlgren, W.Y.; Westenhoff, S.; Tietze, A.A.; Novials, A.; Servitja, J.M.; Maj, M.",,in_vitro,,,P,,EMD-18671,40850490.0,P10997,Homo sapiens (Human),S29P,
8qvq,5,#e5cb5b,0.0,#e55b5b,IAPP,"Cryo-EM structure of human islet amyloid polypeptide (hIAPP) mutant S29P, polymorph 2",13-37 (25),10/18/23,ELECTRON MICROSCOPY,4.07,"Ooi, S.A.; Valli, D.; Kuska, M.I.; Mari, H.; Chaudhary, H.; Wahlgren, W.Y.; Westenhoff, S.; Tietze, A.A.; Novials, A.; Servitja, J.M.; Maj, M.",,in_vitro,,,P,,EMD-18672,40850490.0,P10997,Homo sapiens (Human),S29P,
8qvr,5,#e5cb5b,0.0,#e55b5b,IAPP,"Cryo-EM structure of human islet amyloid polypeptide (hIAPP) mutant S29P, polymorph 3",2-37 (36),10/18/23,ELECTRON MICROSCOPY,3.8,"Ooi, S.A.; Valli, D.; Maj, M.",,in_vitro,,,P,,EMD-18673,,P10997,Homo sapiens (Human),S29P,
8r1s,5,#e5cb5b,4.0,#e5ac5b,IAPP,"Cryo-EM structure of human islet amyloid polypeptide (hIAPP) mutant A25P, polymorph 2",14-33 (20); 16-33 (18),11/2/23,ELECTRON MICROSCOPY,4.11,"Ooi, S.A.; Valli, D.; Maj, M.",,in_vitro,,,P,,EMD-18827,,P10997,Homo sapiens (Human),A25P,
8r4i,5,#e5cb5b,0.0,#e55b5b,IAPP,Cryo-EM structure of human islet amyloid polypeptide (hIAPP),13-37 (25),11/13/23,ELECTRON MICROSCOPY,4.01,"Valli, D.; Ooi, S.A.; Scattolini, G.; Chaudhary, H.; Tietze, A.A.; Maj, M.",,in_vitro,,,P,,EMD-18887,38368506.0,P10997,Homo sapiens (Human),,
8rm8,5,#e5cb5b,0.0,#e55b5b,IAPP,"Cryo-EM structure of human islet amyloid polypeptide (hIAPP) mutant S28P, polymorph 1",8-37 (30); 14-37 (24),1/5/24,ELECTRON MICROSCOPY,3.0,"Ooi, S.A.; Valli, D.; Kuska, M.I.; Mari, H.; Chaudhary, H.; Wahlgren, W.Y.; Westenhoff, S.; Tietze, A.A.; Novials, A.; Servitja, J.M.; Maj, M.",,in_vitro,,,P,,EMD-19353,40850490.0,P10997,Homo sapiens (Human),S28P,
8rm9,5,#e5cb5b,0.0,#e55b5b,IAPP,"Cryo-EM structure of human islet amyloid polypeptide (hIAPP) mutant S28P, polymorph 2",2-37 (36); 14-37 (24),1/5/24,ELECTRON MICROSCOPY,4.06,"Ooi, S.A.; Valli, D.; Kuska, M.I.; Mari, H.; Chaudhary, H.; Wahlgren, W.Y.; Westenhoff, S.; Tietze, A.A.; Novials, A.; Servitja, J.M.; Maj, M.",,in_vitro,,,P,,EMD-19354,40850490.0,P10997,Homo sapiens (Human),S28P,
8sbd,5,#e5cb5b,4.0,#e5ac5b,Insulin,Cryo-EM structure of insulin amyloid-like fibril that is composed of two antiparallel protofilaments,29-51 (23); 91-109 (19),4/3/23,ELECTRON MICROSCOPY,3.2,"Wang, L.; Hall, C.E.; Uchikawa, E.; Chen, D.; Choi, E.; Zhang, X.; Bai, X.C.",,in_vitro,,,P,,EMD-40305,37713485.0,P01308,Homo sapiens (Human),,
8ttl,5,#e5cb5b,4.0,#e5ac5b,Tau,"AT8-Phosphomimetic Tau Filaments (Full-length, Cofactor-Free 0N4R Tau S202E, T205E, S208E)",304-330 (27); 351-440 (90),8/14/23,ELECTRON MICROSCOPY,2.6,"Mammeri, N.E.; Dregni, A.J.; Duan, P.; Hong, M.",,in_vitro,,,P,,EMD-41610,38408247.0,P10636,Homo sapiens (Human),,"S202E, T205E, S208E"
9c1u,5,#e5cb5b,0.0,#e55b5b,Tm1-I/C,Cryo-EM Structure of a Tm1C Fibril,7-Jan,5/29/24,ELECTRON MICROSCOPY,2.31,"Fonda, B.D.; Kato, M.; Li, Y.; Murray, D.T.",,in_vitro,,,S,,EMD-45130,39276003.0,Q8IG84,Drosophila melanogaster (Fruit fly),,
9gz6,5,#e5cb5b,0.0,#e55b5b,IAPP,WT-IAPP cryo-EM structure Type SS - control reaction,12-37 (26),10/3/24,ELECTRON MICROSCOPY,3.3,"Taylor, A.I.P.; Xu, Y.; Wilkinson, M.; Chakraborty, P.; Brinkworth, A.; Willis, L.F.; Zhuravleva, A.; Ranson, N.A.; Foster, R.; Radford, S.E.",,in_vitro,,,P,,EMD-51726,39985130.0,P10997,Homo sapiens (Human),,
9gzp,5,#e5cb5b,4.0,#e5ac5b,IAPP,WT-IAPP cryo-EM structure Type LL - control reaction,15-37 (23),10/4/24,ELECTRON MICROSCOPY,2.9,"Taylor, A.I.P.; Xu, Y.; Wilkinson, M.; Chakraborty, P.; Brinkworth, A.; Willis, L.F.; Zhuravleva, A.; Ranson, N.A.; Foster, R.; Radford, S.E.",,in_vitro,,,P,,EMD-51730,39985130.0,P10997,Homo sapiens (Human),,
9gzs,5,#e5cb5b,4.0,#e5ac5b,IAPP,WT-IAPP cryo-EM structure Type LLU - control reaction,13-37 (25),10/4/24,ELECTRON MICROSCOPY,3.1,"Taylor, A.I.P.; Xu, Y.; Wilkinson, M.; Chakraborty, P.; Brinkworth, A.; Willis, L.F.; Zhuravleva, A.; Ranson, N.A.; Foster, R.; Radford, S.E.",,in_vitro,,,P,,EMD-51733,39985130.0,P10997,Homo sapiens (Human),,
9gzt,5,#e5cb5b,4.0,#e5ac5b,IAPP,WT-IAPP cryo-EM structure Type LLUU - control reaction,13-37 (25); 14-37 (24),10/4/24,ELECTRON MICROSCOPY,2.9,"Taylor, A.I.P.; Xu, Y.; Wilkinson, M.; Chakraborty, P.; Brinkworth, A.; Willis, L.F.; Zhuravleva, A.; Ranson, N.A.; Foster, R.; Radford, S.E.",,in_vitro,,,P,,EMD-51734,39985130.0,P10997,Homo sapiens (Human),,
9gzw,5,#e5cb5b,4.0,#e5ac5b,IAPP,"WT-IAPP cryo-EM structure Type LL, doxazosin reaction",14-37 (24),10/4/24,ELECTRON MICROSCOPY,2.9,"Taylor, A.I.P.; Xu, Y.; Wilkinson, M.; Chakraborty, P.; Brinkworth, A.; Willis, L.F.; Zhuravleva, A.; Ranson, N.A.; Foster, R.; Radford, S.E.",,in_vitro,,,P,,EMD-51735,39985130.0,P10997,Homo sapiens (Human),,
9gzx,5,#e5cb5b,4.0,#e5ac5b,IAPP,"WT-IAPP cryo-EM structure Type LLU, doxazosin reaction",10-37 (28); 14-37 (24),10/4/24,ELECTRON MICROSCOPY,3.1,"Taylor, A.I.P.; Xu, Y.; Wilkinson, M.; Chakraborty, P.; Brinkworth, A.; Willis, L.F.; Zhuravleva, A.; Ranson, N.A.; Foster, R.; Radford, S.E.",,in_vitro,,,P,,EMD-51736,39985130.0,P10997,Homo sapiens (Human),,
9gzy,5,#e5cb5b,4.0,#e5ac5b,IAPP,"WT-IAPP cryo-EM structure Type LLUU, doxazosin reaction",15-37 (23); 16-37 (22),10/4/24,ELECTRON MICROSCOPY,3.0,"Taylor, A.I.P.; Xu, Y.; Wilkinson, M.; Chakraborty, P.; Brinkworth, A.; Willis, L.F.; Zhuravleva, A.; Ranson, N.A.; Foster, R.; Radford, S.E.",,in_vitro,,,P,,EMD-51737,39985130.0,P10997,Homo sapiens (Human),,
9h7u,5,#e5cb5b,4.0,#e5ac5b,synthetic_amyloid_005,Hexagonally Ordered Nanofibrils Easily Yield by dual Amphiphilic Self-Assembling Peptide,1-9 (9),10/28/24,ELECTRON MICROSCOPY,2.96,"Mazzotta, F.; Baptista, L.A.; Schmidt, M.; Lieberwirth, I.; Landfester, K.",,in_vitro,,,S,,EMD-51914,,,,,
9hgb,5,#e5cb5b,4.0,#e5ac5b,Citropin-1.3,Amyloid fibril from the antimicrobial peptide citropin 1-3 - Polymorph Nr.3,1-16 (16),11/19/24,ELECTRON MICROSCOPY,3.1,"Strati, F.; Cali, M.P.; Bloch, Y.; Mostafavi, S.; Monistrol, J.; Golubev, A.; Rayan, B.; Gustavsson, E.; Landau, M.",,in_vitro,,,F,,EMD-52133,41016026.0,P81846,Ranoidea citropa (Australian Blue Mountains tree frog),,
9hgl,5,#e5cb5b,4.0,#e5ac5b,Citropin-1.3,Amyloid fibril from the antimicrobial peptide citropin 1-3 - Polymorph Nr.2,1-16 (16),11/19/24,ELECTRON MICROSCOPY,2.8,"Strati, F.; Cali, M.P.; Bloch, Y.; Mostafavi, S.; Monistrol, J.; Golubev, A.; Rayan, B.; Gustavsson, E.; Landau, M.",,in_vitro,,,F,,EMD-52151,41016026.0,P81846,Ranoidea citropa (Australian Blue Mountains tree frog),,
9hgt,5,#e5cb5b,4.0,#e5ac5b,Citropin-1.3,Amyloid fibril from the antimicrobial peptide citropin 1-3 - Polymorph Nr.1L,1-16 (16),11/20/24,ELECTRON MICROSCOPY,3.0,"Strati, F.; Cali, M.P.; Bloch, Y.; Mostafavi, S.; Monistrol, J.; Golubev, A.; Rayan, B.; Gustavsson, E.; Landau, M.",,in_vitro,,,F,,EMD-52167,41016026.0,P81846,Ranoidea citropa (Australian Blue Mountains tree frog),,
9hi8,5,#e5cb5b,4.0,#e5ac5b,Citropin-1.3,Amyloid fibril from the antimicrobial peptide citropin 1-3 - Polymorph Nr.3L,1-16 (16),11/25/24,ELECTRON MICROSCOPY,3.56,"Strati, F.; Cali, M.P.; Bloch, Y.; Mostafavi, S.; Monistrol, J.; Golubev, A.; Rayan, B.; Gustavsson, E.; Landau, M.",,in_vitro,,,F,,EMD-52185,41016026.0,P81846,Ranoidea citropa (Australian Blue Mountains tree frog),,
9hid,5,#e5cb5b,4.0,#e5ac5b,Citropin-1.3,Amyloid fibril from the antimicrobial peptide citropin 1-3 - Polymorph Nr.2L,1-16 (16),11/25/24,ELECTRON MICROSCOPY,3.2,"Strati, F.; Cali, M.P.; Bloch, Y.; Mostafavi, S.; Monistrol, J.; Golubev, A.; Rayan, B.; Gustavsson, E.; Landau, M.",,in_vitro,,,F,,EMD-52186,41016026.0,P81846,Ranoidea citropa (Australian Blue Mountains tree frog),,
9j4d,5,#e5cb5b,22.0,#5bc7e5,Tubulin polymerization-promoting protein,Cryo-EM structure of P25alpha core fibril,70-104 (35),8/9/24,ELECTRON MICROSCOPY,2.93,"Xia, W.C.; Sun, Y.P.; Huang, C.A.; Liu, C.",,in_vitro,,,P,,EMD-61132,,O94811,Homo sapiens (Human),,
9j4e,5,#e5cb5b,22.0,#5bc7e5,Tubulin polymerization-promoting protein,Cryo-EM structure of P25alpha full-length fibril,69-105 (37),8/9/24,ELECTRON MICROSCOPY,3.32,"Xia, W.C.; Sun, Y.P.; Huang, C.A.; Liu, C.",,in_vitro,,,P,,EMD-61133,,O94811,Homo sapiens (Human),,
9j4f,5,#e5cb5b,22.0,#5bc7e5,Tubulin polymerization-promoting protein,Cryo-EM structure of P25alpha full-length A119V fibril,69-104 (36),8/9/24,ELECTRON MICROSCOPY,2.49,"Xia, W.C.; Sun, Y.P.; Huang, C.A.; Liu, C.",,in_vitro,,,P,,EMD-61134,,O94811,Homo sapiens (Human),,A119V
9kty,5,#e5cb5b,4.0,#e5ac5b,TIA1,"Cryo-EM structure of the TIA-1 prion-like domain amyloid fibril, WT",336-360 (25),12/3/24,ELECTRON MICROSCOPY,3.36,"Inaoka, D.; Miyata, T.; Makino, F.; Ohtani, Y.; Ekari, M.; Kobayashi, R.; Imamura, K.; Sakamoto, E.; Kodama, S.T.; Yoshida, N.; Kato, T.; Namba, K.; Tochio, H.; Sekiyama, N.",,in_vitro,,,P,,EMD-62570,,P31483,Homo sapiens (Human),,
9kzb,5,#e5cb5b,4.0,#e5ac5b,MaSp1,"Cryo-EM structure of amyloid peptide-silk block protein fibril, Type 1",9-23 (15),12/10/24,ELECTRON MICROSCOPY,3.27,"Zhang, Y.L.; Dai, B.",,in_vitro,,,S,,EMD-62658,,,Latrodectus hesperus (Western black widow spider),,
9kzo,5,#e5cb5b,4.0,#e5ac5b,synthetic_amyloid_006,"Cryo-EM structure of amyloid peptide-silk block protein fibril, Type 3",39-54 (16),12/11/24,ELECTRON MICROSCOPY,3.08,"Zhang, Y.L.; Dai, B.",,in_vitro,,,S,,EMD-62666,,,,,
9l2s,5,#e5cb5b,0.0,#e55b5b,MaSp1,"Cryo-EM structure of amyloid peptide-silk block protein fibril, Type 2",23-62 (40),12/17/24,ELECTRON MICROSCOPY,3.08,"Zhang, Y.L.; Dai, B.",,in_vitro,,,S,,EMD-62779,,A6YIY1,Latrodectus hesperus (Western black widow spider),,
9mc2,5,#e5cb5b,4.0,#e5ac5b,Tau,Cryo-EM structure of dopaminated Tau fibril,272-313 (42),3/17/25,ELECTRON MICROSCOPY,3.55,"Liu, Z.; Li, X.; Wang, Q.; Liu, K.; Zeng, W.; Li, D.; Zhao, K.; Ma, Y.; Long, H.; Zhang, S.; Li, D.; Sun, B.; Le, W.; Wang, C.; He, Z.; Kang, W.; Xiao, W.; Liu, C.",,in_vitro,,,P,,EMD-63785,41555553.0,P10636,Homo sapiens (Human),,
9qfm,5,#e5cb5b,4.0,#e5ac5b,12S seed storage protein CRC,LY12 Main Morphology,223-234 (12),3/12/25,ELECTRON MICROSCOPY,2.86,"Kumar, V.; Stoyanov, N.; Kaushik, V.; Kumar, S.; Schmidt, M.; Fandrich, M.; Segal, D.",,in_vitro,,,F,,EMD-53117,41932473.0,Q96318,Arabidopsis thaliana (Mouse-ear cress),,
9rbd,5,#e5cb5b,-1.0,#7f7f7f,Natriuretic peptide A,Cryo-EM structure of ANP amyloids from left atrial appendage of atrial fibrillation patient - polymorph A,128-151 (24),5/22/25,ELECTRON MICROSCOPY,2.96,"Broggini, L.; Piccoli, M.; Chaves-Sanjuan, A.; Bonnet, D.M.V.; Cirillo, F.; Visentin, C.; Sonzini, F.; Signorelli, P.; Lavota, I.; Milazzo, M.; Nonnis, S.; Menicanti, L.; Ciconte, G.; Pappone, C.; Anastasia, L.; Ricagno, S.",√,human_ex_vivo,atrial fibrillation,human left atrial appendage,P,,EMD-53891,41162370.0,P01160,Homo sapiens (Human),,
9rbw,5,#e5cb5b,-1.0,#7f7f7f,Natriuretic peptide A,Cryo-EM structure of ANP amyloids from left atrial appendage of atrial fibrillation patient - polymorph B,126-151 (26),5/27/25,ELECTRON MICROSCOPY,3.3,"Broggini, L.; Piccoli, M.; Chaves-Sanjuan, A.; Bonnet, D.M.V.; Cirillo, F.; Visentin, C.; Sonzini, F.; Signorelli, P.; Lavota, I.; Milazzo, M.; Nonnis, S.; Menicanti, L.; Ciconte, G.; Pappone, C.; Anastasia, L.; Ricagno, S.",√,human_ex_vivo,atrial fibrillation,human left atrial appendage,P,,EMD-53910,41162370.0,P01160,Homo sapiens (Human),,
9s2b,5,#e5cb5b,0.0,#e55b5b,Tau,297-441 delta392-395 tau filaments,297-318 (22),7/21/25,ELECTRON MICROSCOPY,2.9,"Lovestam, S.L.; Scheres, S.H.W.",,in_vitro,,,P,,EMD-54485,,P10636,Homo sapiens (Human),,d392-395
9ulz,5,#e5cb5b,0.0,#e55b5b,IAPP,Cryo-EM structure of hIAPP fibrils extracted from a donor with T2D and pancreatic cancer,2-37 (36),4/21/25,ELECTRON MICROSCOPY,2.9,"Liu, W.; Han, J.; Gong, W.; Zhang, F.; Cao, Q.",√,human_ex_vivo,type 2 diabetes,human pancreas,P,,EMD-64268,41483806.0,P10997,Homo sapiens (Human),,
6dso,6,#e5e15b,15.0,#5be576,SAA,Cryo-EM structure of murine AA amyloid fibril,20-88 (69),6/14/18,ELECTRON MICROSCOPY,3.0,"Liberta, F.; Loerch, S.; Rennegarbe, M.; Schierhorn, A.; Westermark, P.; Westermark, G.T.; Hazenberg, B.P.C.; Grigorieff, N.; Fandrich, M.; Schmidt, M.",,animal_ex_vivo,,mouse spleen,P,,EMD-8910,30846696.0,P05367,Mus musculus (Mouse),,
6zch,6,#e5e15b,15.0,#5be576,SAA,Amyloid fibril morphology II (ex vivo) from murine SAA1.1 protein.,20-88 (69),6/11/20,ELECTRON MICROSCOPY,3.5,"Bansal, A.; Schmidt, M.; Rennegarbe, M.; Haupt, C.; Liberta, F.; Stecher, S.; Puscalau-Girtu, I.; Biedermann, A.; Fandrich, M.",,animal_ex_vivo,,mouse liver,P,,EMD-11164,33579941.0,P05367,Mus musculus (Mouse),,
7ovt,6,#e5e15b,15.0,#5be576,SAA,major seeded in vitro fibril morphology from murine SAA1.1 protein,20-88 (69),6/15/21,ELECTRON MICROSCOPY,2.69,"Heerde, T.; Rennegarbe, M.; Biedermann, A.; Savran, D.; Pfeiffer, P.B.; Hitzenberger, M.; Baur, J.; Puscalau-Girtu, I.; Zacharias, M.; Schwierz, N.; Haupt, C.; Schmidt, M.; Fandrich, M.",,seeded_amplified,,Seeded by ex vivo AA amyloid fibrils (murine liver),P,,EMD-13089,35013242.0,P05367,Mus musculus (Mouse),,
7zky,6,#e5e15b,0.0,#e55b5b,SAA,Amyloid fibril from human systemic AA amyloidosis (vascular variant),20-87 (68),4/13/22,ELECTRON MICROSCOPY,2.56,"Banerjee, S.; Baur, J.; Daniel, C.; Pfeiffer, P.B.; Hitzenberger, M.; Kuhn, L.; Wiese, S.; Bijzet, J.; Haupt, C.; Amann, K.U.; Zacharias, M.; Hazenberg, B.P.C.; Westermark, G.T.; Schmidt, M.; Fandrich, M.",√,human_ex_vivo,AA amyloidosis,human kidney tissue,P,,EMD-14771,36433936.0,P0DJI8,Homo sapiens (Human),,
9r4z,6,#e5e15b,15.0,#5be576,SAA,Murine AA amyloid fibril morphology III (AA III),20-88 (69),5/8/25,ELECTRON MICROSCOPY,3.5,"Andreotti, G.; Higuchi, K.; Schmidt, M.; Fandrich, M.",,animal_ex_vivo,,SAMR1C mouse liver,P,,EMD-53573,40945578.0,P05367,Mus musculus (Mouse),,
6gk3,7,#d2e55b,8.0,#cde55b,Beta-2 microglobulin,Two protofilament beta-2-microglobulin amyloid fibril,22-85 (64),5/18/18,ELECTRON MICROSCOPY,3.98,"Iadanza, M.G.; Silvers, R.; Boardman, J.; Smith, H.I.; Karamanos, T.K.; Debelouchina, G.T.; Su, Y.; Griffin, R.G.; Ranson, N.A.; Radford, S.E.",,in_vitro,,,P,,EMD-0014,30375379.0,P61769,Homo sapiens (Human),,
8a7o,7,#d2e55b,8.0,#cde55b,Beta-2 microglobulin,beta-2-microglobulin DeltaN6 amyloid fibril form 2PFa,7-93 (88),6/21/22,ELECTRON MICROSCOPY,3.0,"Wilkinson, M.; Gallardo, R.U.; Martinez, R.M.; Guthertz, N.; So, M.; Aubrey, L.D.; Radford, S.E.; Ranson, N.A.",,in_vitro,,,P,,EMD-15222,36864041.0,P61769,Homo sapiens (Human),,d6
8a7p,7,#d2e55b,8.0,#cde55b,Beta-2 microglobulin,beta-2-microglobulin DeltaN6 amyloid fibril form 2PFb,7-92 (87),6/21/22,ELECTRON MICROSCOPY,3.4,"Wilkinson, M.; Gallardo, R.U.; Martinez, R.M.; Guthertz, N.; So, M.; Aubrey, L.D.; Radford, S.E.; Ranson, N.A.",,in_vitro,,,P,,EMD-15223,36864041.0,P61769,Homo sapiens (Human),,d6
8a7q,7,#d2e55b,8.0,#cde55b,Beta-2 microglobulin,beta-2-microglobulin V27M amyloid fibril form 4PF,21-84 (64),6/21/22,ELECTRON MICROSCOPY,2.8,"Wilkinson, M.; Gallardo, R.U.; Martinez, R.M.; Guthertz, N.; So, M.; Aubrey, L.D.; Radford, S.E.; Ranson, N.A.",,in_vitro,,,P,,EMD-15224,36864041.0,P61769,Homo sapiens (Human),V27M,
8a7t,7,#d2e55b,8.0,#cde55b,Beta-2 microglobulin,beta-2-microglobulin D76N amyloid fibril form 2PFa,6-90 (85),6/21/22,ELECTRON MICROSCOPY,3.0,"Wilkinson, M.; Gallardo, R.U.; Martinez, R.M.; Guthertz, N.; So, M.; Aubrey, L.D.; Radford, S.E.; Ranson, N.A.",,in_vitro,,,P,,EMD-15225,36864041.0,P61769,Homo sapiens (Human),D76N,
6hud,8,#bce55b,27.0,#5b62e5,IgLC_004,Cryo-EM structure of cardiac amyloid fibrils from an immunoglobulin light chain (AL) amyloidosis patient.,1-37; 66-105 (77),10/6/18,ELECTRON MICROSCOPY,4.0,"Swuec, P.; Lavatelli, F.; Tasaki, M.; Paissoni, C.; Rognoni, P.; Maritan, M.; Brambilla, F.; Milani, P.; Mauri, P.; Camilloni, C.; Palladini, G.; Merlini, G.; Ricagno, S.; Bolognesi, M.",√,human_ex_vivo,AL amyloidosis,human heart (left ventricle),P,,EMD-0274,30894521.0,,Homo sapiens (Human),,
8cpe,8,#bce55b,27.0,#5b62e5,IgLC_007,CryoEM structure of AL55 amyloid fibrils extracted from the kidney of an AL amyloidosis patient.,1-37; 66-105 (77),3/2/23,ELECTRON MICROSCOPY,4.0,"Puri, S.; Schulte, T.; Chaves-Sanjuan, A.; Mazzini, G.; Caminito, S.; Pappone, C.; Anastasia, L.; Milani, P.; Merlini, G.; Bolognesi, M.; Nuvolone, M.; Palladini, G.; Ricagno, S.",√,human_ex_vivo,AL amyloidosis,human kidney,P,,EMD-16780,37516426.0,,Homo sapiens (Human),,
9ljc,8,#bce55b,38.0,#e55b98,IgLC_013,The cryo-EM structure of amyloid fibrils from abdominal fat of a multiple myeloma patient (case 2).,1-39; 61-101 (80),1/14/25,ELECTRON MICROSCOPY,2.7,"Yao, Y.X.; Zhao, Q.Y.; Liu, C.; Li, D.",√,human_ex_vivo,Multiple Myeloma,human abdominal fat,P,,EMD-63142,,,Homo sapiens (Human),,
9oka,8,#bce55b,38.0,#e55b98,IgLC_014,Cardiac lambda-6 light chain amyloid AL-224L single protofilament,1-41; 59-104 (87),5/9/25,ELECTRON MICROSCOPY,2.92,"Hicks, C.W.; Prokaeva, T.; Spencer, B.; Jayaraman, S.; Huda, N.; Wong, S.; Chen, H.; Sanchorawala, V.; Lavatelli, F.; Gursky, O.",√,human_ex_vivo,AL amyloidosis,human heart tissue,P,,EMD-70557,41389958.0,,Homo sapiens (Human),,
6ic3,9,#a6e55b,10.0,#a5e55b,IgLC_001,AL amyloid fibril from a lambda 1 light chain,15-105 (91),12/2/18,ELECTRON MICROSCOPY,3.3,"Radamaker, L.; Lin, Y.H.; Annamalai, K.; Huhn, S.; Hegenbart, U.; Schonland, S.O.; Fritz, G.; Schmidt, M.; Fandrich, M.",√,human_ex_vivo,AL amyloidosis,human heart muscle tissue,P,,EMD-4452,30894526.0,,Homo sapiens (Human),,
6z1i,9,#a6e55b,10.0,#a5e55b,Immunoglobulin lambda variable 3-19,AL amyloid fibril from a lambda 3 light chain in conformation B,9-107 (99),5/13/20,ELECTRON MICROSCOPY,3.4,"Radamaker, L.; Baur, J.; Huhn, S.; Haupt, C.; Hegenbart, U.; Schonland, S.; Bansal, A.; Schmidt, M.; Fandrich, M.",√,human_ex_vivo,AL amyloidosis,human heart,P,,EMD-11030,33558536.0,P01714,Homo sapiens (Human),,
6z1o,9,#a6e55b,10.0,#a5e55b,IgLC_005,AL amyloid fibril from a lambda 3 light chain in conformation A,28-68; 79-126 (89),5/14/20,ELECTRON MICROSCOPY,3.2,"Radamaker, L.; Baur, J.; Huhn, S.; Haupt, C.; Hegenbart, U.; Schonland, S.; Bansal, A.; Schmidt, M.; Fandrich, M.",√,human_ex_vivo,AL amyloidosis,human heart tissue,P,,EMD-11031,33558536.0,P01714,Homo sapiens (Human),,
7nsl,9,#a6e55b,-1.0,#7f7f7f,IgLC_006,AL amyloid fibril from a lambda 1 light chain,9-52; 68-108 (85),3/8/21,ELECTRON MICROSCOPY,3.1,"Radamaker, L.; Karimi-Farsijani, S.; Andreotti, G.; Baur, J.; Neumann, M.; Schreiner, S.; Berghaus, N.; Motika, R.; Haupt, C.; Walther, P.; Schmidt, V.; Huhn, S.; Hegenbart, U.; Schonland, S.O.; Wiese, S.; Read, C.; Schmidt, M.; Fandrich, M.",√,human_ex_vivo,AL amyloidosis,human heart,P,,EMD-12570,34741031.0,,Homo sapiens (Human),,
8r47,9,#a6e55b,-1.0,#7f7f7f,IgLC_002,AL amyloid fibril from the FOR010 light chain,13-49; 61-106 (103),11/13/23,ELECTRON MICROSCOPY,2.25,"Karimi-Farsijani, S.; Pfeiffer, P.B.; Banerjee, S.; Baur, J.; Kuhn, L.; Kupfer, N.; Hegenbart, U.; Schonland, S.O.; Wiese, S.; Haupt, C.; Schmidt, M.; Fandrich, M.",√,human_ex_vivo,AL amyloidosis,human cardiac tissue,P,,EMD-18881,38879609.0,,Homo sapiens (Human),,
9eme,9,#a6e55b,10.0,#a5e55b,IgLC_003,AL amyloid fibril from the FOR103 light chain,9-52; 61-108 (92),3/8/24,ELECTRON MICROSCOPY,2.92,"Karimi-Farsijani, S.; Pfeiffer, P.B.; Banerjee, S.; Baur, J.; Kuhn, L.; Kupfer, N.; Hegenbart, U.; Schonland, S.O.; Wiese, S.; Haupt, C.; Schmidt, M.; Fandrich, M.",√,human_ex_vivo,AL amyloidosis,human abdominal fat tissue,P,,EMD-19818,38879609.0,,Homo sapiens (Human),,
9liv,9,#a6e55b,10.0,#a5e55b,IgLC_009,The cryo-EM structure of amyloid fibrils from abdominal fat of an AL amyloidosis patient (case 1) - polymorph 1.,8-109 (102),1/14/25,ELECTRON MICROSCOPY,3.1,"Yao, Y.; Zhao, Q.; Yao, S.; Xu, Y.; Liu, K.; Cao, T.; Sun, B.; Zhou, J.; Liu, C.; Li, D.",√,human_ex_vivo,AL amyloidosis,human abdominal fat biopsy (case 1),P,,EMD-63124,41493812.0,,Homo sapiens (Human),,
9liw,9,#a6e55b,10.0,#a5e55b,IgLC_009,The cryo-EM structure of amyloid fibrils from heart of an AL amyloidosis patient (case 1) - polymorph 1.,8-109 (102),1/14/25,ELECTRON MICROSCOPY,3.2,"Yao, Y.; Zhao, Q.; Yao, S.; Xu, Y.; Liu, K.; Cao, T.; Sun, B.; Zhou, J.; Liu, C.; Li, D.",√,human_ex_vivo,AL amyloidosis,human heart,P,,EMD-63125,41493812.0,,Homo sapiens (Human),,
9lix,9,#a6e55b,35.0,#e55bd4,IgLC_010,The cryo-EM structure of amyloid fibrils from abdominal fat of an AL amyloidosis patient (case 2) - polymorph 1.,16-54; 61-110 (89),1/14/25,ELECTRON MICROSCOPY,3.0,"Yao, Y.; Zhao, Q.; Yao, S.; Xu, Y.; Liu, K.; Cao, T.; Sun, B.; Zhou, J.; Liu, C.; Li, D.",√,human_ex_vivo,AL amyloidosis,human abdominal fat,P,,EMD-63126,41493812.0,,Homo sapiens (Human),,
9liy,9,#a6e55b,35.0,#e55bd4,IgLC_010,The cryo-EM structure of amyloid fibrils from abdominal fat of an AL amyloidosis patient (case 2) - polymorph 2.,16-54; 70-110 (80),1/14/25,ELECTRON MICROSCOPY,3.2,"Yao, Y.; Zhao, Q.; Yao, S.; Xu, Y.; Liu, K.; Cao, T.; Sun, B.; Zhou, J.; Liu, C.; Li, D.",√,human_ex_vivo,AL amyloidosis,human abdominal fat biopsy (case 2),P,,EMD-63127,41493812.0,,Homo sapiens (Human),,
9lj0,9,#a6e55b,-1.0,#7f7f7f,IgLC_011,The cryo-EM structure of amyloid fibrils from abdominal fat of an AL amyloidosis patient (case 3).,17-110 (94),1/14/25,ELECTRON MICROSCOPY,3.3,"Yao, Y.; Zhao, Q.; Yao, S.; Xu, Y.; Liu, K.; Cao, T.; Sun, B.; Zhou, J.; Liu, C.; Li, D.",√,human_ex_vivo,AL amyloidosis,human abdominal fat biopsy,P,,EMD-63129,41493812.0,,Homo sapiens (Human),,
9lja,9,#a6e55b,36.0,#e55bc0,IgLC_012,The cryo-EM structure of amyloid fibrils from abdominal fat of a multiple myeloma patient (case 1)- polymorph 1.,6-107 (102),1/14/25,ELECTRON MICROSCOPY,3.1,"Yao, Y.X.; Zhao, Q.Y.; Liu, C.; Li, D.",√,human_ex_vivo,Multiple Myeloma,human abdominal fat,P,,EMD-63140,,,Homo sapiens (Human),,
9ljb,9,#a6e55b,36.0,#e55bc0,IgLC_012,The cryo-EM structure of amyloid fibrils from abdominal fat of a multiple myeloma patient (case 1)- polymorph 2.,7-107 (101),1/14/25,ELECTRON MICROSCOPY,3.2,"Yao, Y.X.; Zhao, Q.Y.; Liu, C.; Li, D.",√,human_ex_vivo,Multiple Myeloma,human abdominal fat,P,,EMD-63141,,,Homo sapiens (Human),,
6l1t,10,#8fe55b,28.0,#695be5,a-synuclein,Cryo-EM structure of phosphorylated Tyr39 a-synuclein amyloid fibril,1-100 (100),9/30/19,ELECTRON MICROSCOPY,3.22,"Zhao, K.; Lim, Y.J.; Liu, Z.; Long, H.; Sun, Y.; Hu, J.J.; Zhao, C.; Tao, Y.; Zhang, X.; Li, D.; Li, Y.M.; Liu, C.",,in_vitro,,,P,,EMD-0801,32737160.0,P37840,Homo sapiens (Human),,pY39
6l1u,10,#8fe55b,28.0,#695be5,a-synuclein,Cryo-EM structure of phosphorylated Tyr39 alpha-synuclein amyloid fibril,1-100 (100),9/30/19,ELECTRON MICROSCOPY,3.37,"Zhao, K.; Lim, Y.J.; Liu, Z.; Long, H.; Sun, Y.; Hu, J.J.; Zhao, C.; Tao, Y.; Zhang, X.; Li, D.; Li, Y.M.; Liu, C.",,in_vitro,,,P,,EMD-0803,32737160.0,P37840,Homo sapiens (Human),,pY39
8adu,10,#8fe55b,19.0,#5be5c7,a-synuclein,Lipidic alpha-synuclein fibril - polymorph L1A,1-99 (99),7/11/22,ELECTRON MICROSCOPY,3.24,"Frieg, B.; Antonschmidt, L.; Dienemann, C.; Geraets, J.A.; Najbauer, E.E.; Matthes, D.; de Groot, B.L.; Andreas, L.B.; Becker, S.; Griesinger, C.; Schroder, G.F.",,in_vitro,,,P,,EMD-15370,36357403.0,P37840,Homo sapiens (Human),,
8adv,10,#8fe55b,19.0,#5be5c7,a-synuclein,Lipidic alpha-synuclein fibril - polymorph L1B,1-99 (99),7/11/22,ELECTRON MICROSCOPY,2.98,"Frieg, B.; Antonschmidt, L.; Dienemann, C.; Geraets, J.A.; Najbauer, E.E.; Matthes, D.; de Groot, B.L.; Andreas, L.B.; Becker, S.; Griesinger, C.; Schroder, G.F.",,in_vitro,,,P,,EMD-15371,36357403.0,P37840,Homo sapiens (Human),,
8adw,10,#8fe55b,19.0,#5be5c7,a-synuclein,Lipidic alpha-synuclein fibril - polymorph L1C,1-99 (99),7/11/22,ELECTRON MICROSCOPY,2.95,"Frieg, B.; Antonschmidt, L.; Dienemann, C.; Geraets, J.A.; Najbauer, E.E.; Matthes, D.; de Groot, B.L.; Andreas, L.B.; Becker, S.; Griesinger, C.; Schroder, G.F.",,in_vitro,,,P,,EMD-15372,36357403.0,P37840,Homo sapiens (Human),,
8gf7,10,#8fe55b,8.0,#cde55b,a-synuclein,Cryo-EM structure of serine 87 O-GlcNAc-modified alpha-synuclein fibrils,7-96 (90),3/7/23,ELECTRON MICROSCOPY,4.8,"Balana, A.T.; Mahul-Mellier, A.L.; Nguyen, B.A.; Horvath, M.; Javed, A.; Hard, E.R.; Jasiqi, Y.; Singh, P.; Afrin, S.; Pedretti, R.; Singh, V.; Lee, V.M.; Luk, K.C.; Saelices, L.; Lashuel, H.A.; Pratt, M.R.",,in_vitro,,,P,,EMD-29980,38347213.0,P37840,Homo sapiens (Human),,S87OGlcnac
8pk4,10,#8fe55b,17.0,#5be59e,a-synuclein,Cryo EM structure of the type 5A polymorph of alpha-synuclein.,2-96 (95),6/24/23,ELECTRON MICROSCOPY,3.3,"Frey, L.; Ghosh, D.; Qureshi, B.M.; Rhyner, D.; Guerrero-Ferreira, R.; Pokharna, A.; Kwiatkowski, W.; Serdiuk, T.; Picotti, P.; Riek, R.; Greenwald, J.",,in_vitro,,,P,,EMD-17726,39196271.0,P37840,Homo sapiens (Human),,
