id,cluster_thermodynamics,cluster_color_thermodynamics,cluster,cluster_color,Protein,Structure Title,Residues (Length),Dep. Date,Exp_Method,Resolution,Authors,From Patient,Sample origin,Disease,Tissue,Role (P/F/S),BMRB,EMDB,PubMed,UniProt,Organism,Mutation,Modification
9czi,1,#e5725b,1.0,#e56f5b,Tau,Paired helical tau filaments in dominantly inherited Alzheimer disease with cotton wool plaques,306-378 (73),8/5/24,ELECTRON MICROSCOPY,3.0,"Hoq, M.R.; Fernandez, A.; Vago, F.S.; Hallinan, G.I.; Bharath, S.R.; Li, D.; Ozcan, K.A.; Garringer, H.J.; Jiang, W.; Vidal, R.; Ghetti, B.",√,human_ex_vivo,Alzheimer's disease,"human cerebral cortex (DIAD, PSEN1 V261I and PSEN1 A431E)",P,,EMD-46417,39147931.0,P10636,Homo sapiens (Human),,
9czl,1,#e5725b,1.0,#e56f5b,Tau,Straight tau filaments in dominantly inherited Alzheimer disease with cotton wool plaques,305-378 (74),8/5/24,ELECTRON MICROSCOPY,2.9,"Hoq, M.R.; Fernandez, A.; Vago, F.S.; Hallinan, G.I.; Bharath, S.R.; Li, D.; Ozcan, K.A.; Garringer, H.J.; Jiang, W.; Vidal, R.; Ghetti, B.",√,human_ex_vivo,Alzheimer's disease,"human frontal cortex (DIAD, PSEN1 V261I and A431E cases)",P,,EMD-46420,39147931.0,P10636,Homo sapiens (Human),,
9eo7,1,#e5725b,1.0,#e56f5b,Tau,PHF type tau filament from V337M mutant,304-380 (77),3/14/24,ELECTRON MICROSCOPY,2.8,"Qi, C.; Lovestam, S.; Murzin, A.G.; Peak-Chew, S.; Franco, C.; Bogdani, M.; Latimer, C.; Murrell, J.R.; Cullinane, P.W.; Jaunmuktane, Z.; Bird, T.D.; Ghetti, B.; Scheres, S.H.W.; Goedert, M.",√,human_ex_vivo,frontotemporal dementia,human frontal cortex,P,,EMD-19846,40044789.0,P10636,Homo sapiens (Human),V337M,
9eo9,1,#e5725b,1.0,#e56f5b,Tau,SF type tau filament from V337M mutant,304-380 (77),3/14/24,ELECTRON MICROSCOPY,3.3,"Qi, C.; Lovestam, S.; Murzin, A.G.; Peak-Chew, S.; Franco, C.; Bogdani, M.; Latimer, C.; Murrell, J.R.; Cullinane, P.W.; Jaunmuktane, Z.; Bird, T.D.; Ghetti, B.; Scheres, S.H.W.; Goedert, M.",√,human_ex_vivo,frontotemporal dementia,human frontal cortex,P,,EMD-19849,40044789.0,P10636,Homo sapiens (Human),V337M,
9eoe,1,#e5725b,1.0,#e56f5b,Tau,TF type tau filament from V337M mutant,304-380 (77),3/14/24,ELECTRON MICROSCOPY,2.3,"Qi, C.; Lovestam, S.; Murzin, A.G.; Peak-Chew, S.; Franco, C.; Bogdani, M.; Latimer, C.; Murrell, J.R.; Cullinane, P.W.; Jaunmuktane, Z.; Bird, T.D.; Ghetti, B.; Scheres, S.H.W.; Goedert, M.",√,human_ex_vivo,frontotemporal dementia,human frontal cortex,P,,EMD-19852,40044789.0,P10636,Homo sapiens (Human),V337M,
9eog,1,#e5725b,1.0,#e56f5b,Tau,PHF type tau filament from R406W mutant,304-380 (77),3/14/24,ELECTRON MICROSCOPY,3.0,"Qi, C.; Lovestam, S.; Murzin, A.G.; Peak-Chew, S.; Franco, C.; Bogdani, M.; Latimer, C.; Murrell, J.R.; Cullinane, P.W.; Jaunmuktane, Z.; Bird, T.D.; Ghetti, B.; Scheres, S.H.W.; Goedert, M.",√,human_ex_vivo,frontotemporal dementia,human frontal cortex,P,,EMD-19854,40044789.0,P10636,Homo sapiens (Human),,R406W
9eoh,1,#e5725b,1.0,#e56f5b,Tau,PHF type tau filament from in vitro V337M mutant,306-379 (74),3/14/24,ELECTRON MICROSCOPY,2.8,"Qi, C.; Lovestam, S.; Murzin, A.G.; Peak-Chew, S.; Franco, C.; Bogdani, M.; Latimer, C.; Murrell, J.R.; Cullinane, P.W.; Jaunmuktane, Z.; Bird, T.D.; Ghetti, B.; Scheres, S.H.W.; Goedert, M.",,in_vitro,,,P,,EMD-19855,40044789.0,P10636,Homo sapiens (Human),V337M,
9erm,1,#e5725b,1.0,#e56f5b,Tau,CTE type I tau filament from vacuolar tauopathy,305-379 (75),3/24/24,ELECTRON MICROSCOPY,2.3,"Qi, C.; Kobayashi, R.; Kawakatsu, S.; Kametani, F.; Scheres, S.H.W.; Goedert, M.; Hasegawa, M.",√,human_ex_vivo,vacuolar tauopathy,human frontal and temporal cortex,P,,EMD-19926,38758288.0,P10636,Homo sapiens (Human),,
9ern,1,#e5725b,1.0,#e56f5b,Tau,CTE type II tau filament from vacuolar tauopathy,305-379 (75),3/24/24,ELECTRON MICROSCOPY,2.5,"Qi, C.; Kobayashi, R.; Kawakatsu, S.; Kametani, F.; Scheres, S.H.W.; Goedert, M.; Hasegawa, M.",√,human_ex_vivo,vacuolar tauopathy,human frontal and temporal cortex,P,,EMD-19927,38758288.0,P10636,Homo sapiens (Human),,
9ero,1,#e5725b,1.0,#e56f5b,Tau,CTE type III tau filament from vacuolar tauopathy,305-379 (75),3/24/24,ELECTRON MICROSCOPY,2.9,"Qi, C.; Kobayashi, R.; Kawakatsu, S.; Kametani, F.; Scheres, S.H.W.; Goedert, M.; Hasegawa, M.",√,human_ex_vivo,vacuolar tauopathy,human frontal cortex,P,,EMD-19928,38758288.0,P10636,Homo sapiens (Human),,
9fh6,1,#e5725b,1.0,#e56f5b,Tau,Cryo-EM Structure of Tau Filaments from Individuals Carrying the Uppsala AbetaUpp(1-42)delta(19-24) Mutation,306-378 (73),5/26/24,ELECTRON MICROSCOPY,3.3,"Zielinski, M.; Peralta Reyes, F.S.; Gremer, L.; Sommerhage, S.; Pagnon de la Vega, M.; Roder, C.; Heidler, T.V.; Syvanen, S.; Willbold, D.; Sehlin, D.; Ingelsson, M.; Schroder, G.F.",√,human_ex_vivo,Alzheimer's disease,human temporal cortex (Uppsala APP mutation carrier),P,,EMD-50441,41044681.0,P10636,Homo sapiens (Human),,
9h5g,1,#e5725b,1.0,#e56f5b,Tau,PAD12 0N3R:0N4R tau PHF,307-378 (72),10/22/24,ELECTRON MICROSCOPY,2.48,"Lovestam, S.; Scheres, S.H.W.; Goedert, M.",,in_vitro,,,P,,EMD-51884,,P10636,Homo sapiens (Human),,"T153D, T181D, S202D, T205D, T212D, S214D, T217D, T231D, S235D, S237D, S262D, T263D, S396D, S400D, T403D, S404D"
9h5j,1,#e5725b,1.0,#e56f5b,Tau,PAD12 0N3R tau PHF seeded by AD,307-378 (72),10/22/24,ELECTRON MICROSCOPY,2.72,"Lovestam, S.; Scheres, S.H.W.; Goedert, M.",,seeded_amplified,AD,Seeded,P,,EMD-51886,,P10636,Homo sapiens (Human),,"T153D, T181D, S202D, T205D, T212D, S214D, T217D, T231D, S235D, S237D, S262D, T263D, S396D, S400D, T403D, S404D"
9hbb,1,#e5725b,1.0,#e56f5b,Tau,Recombinant tau PHF filaments (peptide synthesis 291-391),304-379 (76),11/6/24,ELECTRON MICROSCOPY,3.0,"Powell, W.C.; Nahum, M.; Pankratz, K.; Herlory, M.; Greenwood, J.; Poliyenko, D.; Holland, P.; Jing, R.; Biggerstaff, L.; Stowell, M.H.B.; Walczak, M.A.",,in_vitro,,,P,,EMD-52014,38559065.0,P10636,Homo sapiens (Human),,
9o6v,1,#e5725b,1.0,#e56f5b,Tau,Recombinant AD PHF complexed with SW-MK-NBD (PHF2),305-379 (75),4/14/25,ELECTRON MICROSCOPY,2.72,"Kunach, P.; Diamond, M.I.",,in_vitro,,,P,,EMD-70182,,P10636,Homo sapiens (Human),,
9o6w,1,#e5725b,1.0,#e56f5b,Tau,Recombinant AD PHF complexed with SW-MK-NBD (Non Symmetric Binding Site),305-379 (75),4/14/25,ELECTRON MICROSCOPY,2.67,"Kunach, P.; Diamond, M.I.",,in_vitro,,,P,,EMD-70183,,P10636,Homo sapiens (Human),,
9o6x,1,#e5725b,1.0,#e56f5b,Tau,Recombinant AD THF incubated with SW-MK-NBD (Non-Symmetric Binding),305-379 (75),4/14/25,ELECTRON MICROSCOPY,2.58,"Kunach, P.; Diamond, M.I.",,in_vitro,,,P,,EMD-70184,,P10636,Homo sapiens (Human),,
9o6y,1,#e5725b,1.0,#e56f5b,Tau,Recombinant AD PHF complexed with SW-MK-NBD,305-379 (75),4/14/25,ELECTRON MICROSCOPY,2.72,"Kunach, P.; Diamond, M.I.",,in_vitro,,,P,,EMD-70185,,P10636,Homo sapiens (Human),,
9o6z,1,#e5725b,1.0,#e56f5b,Tau,Recombinant AD THF with SW-MK-NBD complexed in AD-related Binding Site,305-379 (75),4/14/25,ELECTRON MICROSCOPY,2.31,"Kunach, P.; Diamond, M.I.",,in_vitro,,,P,,EMD-70187,,P10636,Homo sapiens (Human),,
9o76,1,#e5725b,1.0,#e56f5b,Tau,Recombinant AD THF complexed with SW-MK-NBD (Secondary Binding Site),305-379 (75),4/14/25,ELECTRON MICROSCOPY,2.58,"Kunach, P.; Diamond, M.I.",,in_vitro,,,P,,EMD-70188,,P10636,Homo sapiens (Human),,
9o79,1,#e5725b,1.0,#e56f5b,Tau,Recombinant AD PHF incubated with DMSO (Kinked Backbone E342),305-379 (75),4/14/25,ELECTRON MICROSCOPY,2.55,"Kunach, P.; Diamond, M.I.",,in_vitro,,,P,,EMD-70191,,P10636,Homo sapiens (Human),,
9o7b,1,#e5725b,1.0,#e56f5b,Tau,Recombinant AD THF incubated with DMSO (Kinked Backbone E342),305-379 (75),4/14/25,ELECTRON MICROSCOPY,2.31,"Kunach, P.; Diamond, M.I.",,in_vitro,,,P,,EMD-70193,,P10636,Homo sapiens (Human),,
9o7c,1,#e5725b,1.0,#e56f5b,Tau,Recombinant AD THF incubated with DMSO (Flat Backbone E342),305-379 (75),4/14/25,ELECTRON MICROSCOPY,2.31,"Kunach, P.; Diamond, M.I.",,in_vitro,,,P,,EMD-70194,,P10636,Homo sapiens (Human),,
9o8h,1,#e5725b,37.0,#e55bac,Tau,amyloid fibril of recombinant full-length 2N4R tau complexed with mouse liver 18S ribosomal RNA,273-342 (70),4/15/25,ELECTRON MICROSCOPY,3.3,"Abskharon, R.; Jiang, Y.X.; Sawaya, M.R.; Ge, P.; Zhang, J.; Boyer, D.R.; Dolinsky, J.L.; Pi, J.; Cascio, D.; Guo, F.; Eisenberg, D.S.",,in_vitro,,,P,,EMD-70227,42006351.0,P10636,Homo sapiens (Human),,
9pgo,1,#e5725b,1.0,#e56f5b,Tau,Cryo-EM structure of brain-derived Tau fibril from Alzheimers disease patient tissue,305-378 (74),7/8/25,ELECTRON MICROSCOPY,2.29,"Pierson, J.A.; Sanchez, J.C.; Kraemer, B.C.; Wright, E.R.; Latimer, C.S.",√,human_ex_vivo,Alzheimer's disease,human brain (Alzheimer's disease patient),P,,EMD-71636,,P10636,Homo sapiens (Human),,
9r2f,1,#e5725b,1.0,#e56f5b,Tau,Tau filaments seeded by AD homogenate using 0N3R C322A,307-378 (72),4/30/25,ELECTRON MICROSCOPY,2.8,"Santambrogio, A.; Lovestam, S.; Metrick the Second, M.A.; Lohr, T.; Xu, P.; Gallagher, N.C.T.; Ghetti, B.; Caughey, B.; Scheres, S.H.W.; Vendruscolo, M.",,seeded_amplified,AD brain homogenate (frontal cortex),Seeded,P,,EMD-53527,41026859.0,P10636,Homo sapiens (Human),C322A,
9shs,1,#e5725b,1.0,#e56f5b,Tau,Head to Head tau filament with the Alzheimer's fold,304-379 (76),8/27/25,ELECTRON MICROSCOPY,3.4,"Katsinelos, T.; Lovestam, S.; Qi, C.; Ryskeldi-Falcon, B.; Macdonald, J.A.; Stephenson, G.; Ghetti, B.; McKee, A.; Scheres, S.H.W.; Goedert, M.",,seeded_amplified,Alzheimer's disease brain (frontal cortex),Seeded,P,,EMD-54909,41260337.0,P10636,Homo sapiens (Human),,
9tzx,1,#e5725b,1.0,#e56f5b,Tau,Cryo-EM structure of a tau filament,307-377 (71),1/25/26,ELECTRON MICROSCOPY,2.75,"Banerjee, V.; Gorski, D.; Baker, M.; Soto, C.",,in_vitro,,,P,,EMD-56478,,P10636,Homo sapiens (Human),,
10xu,2,#e5885b,2.0,#e5845b,a-synuclein,Structure of amplified aSyn filament by using seed amplification assay (SAA) from MSA patient CSF.,35-98 (64),2/11/26,ELECTRON MICROSCOPY,3.18,"Wang, F.; Banerjee, V.; Barria, C.; Ramirez, S.; Allison, T.; Gorski, D.; Evans, H.; Nguyen, Q.; Harrison, D.; Al-Lahham, R.; De Gregorio Carbonell, N.; Pinho, M.; Kaalund, S.; Folke, J.; Aznar, S.; Concha-Marambio, L.; Ishtikhar, M.; Mallampalli, V.K.; Pritzkow, S.; Shahnawaz, M.; Baker, M.L.; Serysheva, I.; Soto, C.",,seeded_amplified,MSA patient CSF,Amplified,P,,EMD-75514,41372188.0,P37840,Homo sapiens (Human),,
6a6b,2,#e5885b,2.0,#e5845b,a-synuclein,cryo-em structure of alpha-synuclein fiber,37-99 (63),6/27/18,ELECTRON MICROSCOPY,3.07,"Li, Y.; Zhao, C.; Luo, F.; Liu, Z.; Gui, X.; Luo, Z.; Zhang, X.; Li, D.; Liu, C.; Li, X.",,in_vitro,,,P,,EMD-6988,30065316.0,P37840,Homo sapiens (Human),,
6cu7,2,#e5885b,2.0,#e5845b,a-synuclein,Alpha Synuclein fibril formed by full length protein - Rod Polymorph,38-97 (60),3/23/18,ELECTRON MICROSCOPY,3.5,"Li, B.; Ge, P.; Murray, K.A.; Sheth, P.; Zhang, M.; Nair, G.; Sawaya, M.R.; Shin, W.S.; Boyer, D.R.; Ye, S.; Eisenberg, D.S.; Zhou, Z.H.; Jiang, L.",,in_vitro,,,P,,EMD-7618,30190461.0,P37840,Homo sapiens (Human),,
6cu8,2,#e5885b,3.0,#e5985b,a-synuclein,Alpha Synuclein fibril formed by full length protein - Twister Polymorph,43-83 (41),3/23/18,ELECTRON MICROSCOPY,3.6,"Li, B.; Ge, P.; Murray, K.A.; Sheth, P.; Zhang, M.; Nair, G.; Sawaya, M.R.; Shin, W.S.; Boyer, D.R.; Ye, S.; Eisenberg, D.S.; Zhou, Z.H.; Jiang, L.",,in_vitro,,,P,,EMD-7619,30190461.0,P37840,Homo sapiens (Human),,
6h6b,2,#e5885b,2.0,#e5845b,a-synuclein,Structure of alpha-synuclein fibrils,38-95 (58),7/26/18,ELECTRON MICROSCOPY,3.4,"Guerrero-Ferreira, R.; Taylor, N.M.; Mona, D.; Ringler, P.; Lauer, M.E.; Riek, R.; Britschgi, M.; Stahlberg, H.",,in_vitro,,,P,,EMD-0148,29969391.0,P37840,Homo sapiens (Human),,
6lrq,2,#e5885b,2.0,#e5845b,a-synuclein,Cryo-EM structure of A53T alpha-synuclein amyloid fibril,37-99 (63),1/16/20,ELECTRON MICROSCOPY,3.49,"Sun, Y.; Hou, S.; Zhao, K.; Long, H.; Liu, Z.; Gao, J.; Zhang, Y.; Su, X.D.; Li, D.; Liu, C.",,in_vitro,,,P,,EMD-0958,32203130.0,P37840,Homo sapiens (Human),A53T,
6osj,2,#e5885b,2.0,#e5845b,a-synuclein,Cryo-EM structure of the N-terminally acetylated full length alpha-synuclein fibrils (Ac1-140),37-97 (61),5/1/19,ELECTRON MICROSCOPY,2.8,"Ni, X.; McGlinchey, R.P.; Jiang, J.; Lee, J.C.",,in_vitro,,,P,,EMD-20183,31295458.0,P37840,Homo sapiens (Human),,
6osl,2,#e5885b,2.0,#e5845b,a-synuclein,Cryo-EM structure of the N-terminally acetylated C-terminal Alpha-synuclein truncation Ac1-122,39-97 (59),5/1/19,ELECTRON MICROSCOPY,3.0,"Ni, X.; McGlinchey, R.P.; Jiang, J.; Lee, J.C.",,in_vitro,,,P,,EMD-20185,31295458.0,P37840,Homo sapiens (Human),,
6osm,2,#e5885b,2.0,#e5845b,a-synuclein,Cryo-EM structure of the N-terminally acetylated C-terminal Alpha-synuclein truncation Ac1-103,37-96 (60),5/1/19,ELECTRON MICROSCOPY,3.4,"Ni, X.; McGlinchey, R.P.; Jiang, J.; Lee, J.C.",,in_vitro,,,P,,EMD-20186,31295458.0,P37840,Homo sapiens (Human),,
6peo,2,#e5885b,2.0,#e5845b,a-synuclein,Cryo-EM structure of alpha-synuclein H50Q Narrow Fibril,36-99 (64),6/20/19,ELECTRON MICROSCOPY,3.3,"Boyer, D.R.; Li, B.; Sun, C.; Fan, W.; Sawaya, M.R.; Jiang, L.; Eisenberg, D.S.",,in_vitro,,,P,,EMD-20328,31695184.0,P37840,Homo sapiens (Human),H50Q,
6pes,2,#e5885b,2.0,#e5845b,a-synuclein,Cryo-EM structure of alpha-synuclein H50Q Wide Fibril,36-99 (64),6/20/19,ELECTRON MICROSCOPY,3.6,"Boyer, D.R.; Li, B.; Sun, C.; Fan, W.; Sawaya, M.R.; Jiang, L.; Eisenberg, D.S.",,in_vitro,,,P,,EMD-20331,31695184.0,P37840,Homo sapiens (Human),H50Q,
6rt0,2,#e5885b,3.0,#e5985b,a-synuclein,cryo-em structure of alpha-synuclein fibril polymorph 2A,14-25; 36-97 (74),5/22/19,ELECTRON MICROSCOPY,3.1,"Guerrero-Ferreira, R.; Taylor, N.M.; Arteni, A.A.; Kumari, P.; Mona, D.; Ringler, P.; Britschgi, M.; Lauer, M.E.; Makky, A.; Verasdonck, J.; Riek, R.; Melki, R.; Meier, B.H.; Bockmann, A.; Bousset, L.; Stahlberg, H.",,in_vitro,,,P,,EMD-4994,31815671.0,P37840,Homo sapiens (Human),,
6rtb,2,#e5885b,3.0,#e5985b,a-synuclein,cryo-em structure of alpha-synuclein fibril polymorph 2B,9-24; 35-56; 62-93 (70),5/22/19,ELECTRON MICROSCOPY,3.46,"Guerrero-Ferreira, R.; Taylor, N.M.; Arteni, A.A.; Kumari, P.; Mona, D.; Ringler, P.; Britschgi, M.; Lauer, M.E.; Makky, A.; Verasdonck, J.; Riek, R.; Melki, R.; Meier, B.H.; Bockmann, A.; Bousset, L.; Stahlberg, H.",,in_vitro,,,P,,EMD-4996,31815671.0,P37840,Homo sapiens (Human),,
6sst,2,#e5885b,3.0,#e5985b,a-synuclein,cryo-em structure of alpha-synuclein fibril polymorph 2B,14-25; 36-96 (73),9/9/19,ELECTRON MICROSCOPY,3.4,"Guerrero-Ferreira, R.; Taylor, N.M.; Arteni, A.A.; Kumari, P.; Mona, D.; Ringler, P.; Britschgi, M.; Lauer, M.E.; Makky, A.; Verasdonck, J.; Riek, R.; Melki, R.; Meier, B.H.; Bockmann, A.; Bousset, L.; Stahlberg, H.",,in_vitro,,,P,,EMD-10305,31815671.0,P37840,Homo sapiens (Human),,
6ssx,2,#e5885b,3.0,#e5985b,a-synuclein,cryo-em structure of alpha-synuclein fibril polymorph 2A,14-25; 36-96 (73),9/9/19,ELECTRON MICROSCOPY,2.98,"Guerrero-Ferreira, R.; Taylor, N.M.; Arteni, A.A.; Kumari, P.; Mona, D.; Ringler, P.; Britschgi, M.; Lauer, M.E.; Makky, A.; Verasdonck, J.; Riek, R.; Melki, R.; Meier, B.H.; Bockmann, A.; Bousset, L.; Stahlberg, H.",,in_vitro,,,P,,EMD-10307,31815671.0,P37840,Homo sapiens (Human),,
6ufr,2,#e5885b,3.0,#e5985b,a-synuclein,Structure of recombinantly assembled E46K alpha-synuclein fibrils,36-98 (63),9/24/19,ELECTRON MICROSCOPY,2.5,"Boyer, D.R.; Li, B.; Sun, C.; Fan, W.; Zhou, K.; Hughes, M.P.; Sawaya, M.R.; Jiang, L.; Eisenberg, D.S.",,in_vitro,,,P,,EMD-20759,32015135.0,P37840,Homo sapiens (Human),E46K,
6xyo,2,#e5885b,2.0,#e5845b,a-synuclein,Multiple system atrophy Type I alpha-synuclein filament,14-99 (86),1/30/20,ELECTRON MICROSCOPY,2.6,"Schweighauser, M.; Shi, Y.; Tarutani, A.; Kametani, F.; Murzin, A.G.; Ghetti, B.; Matsubara, T.; Tomita, T.; Ando, T.; Hasegawa, K.; Murayama, S.; Yoshida, M.; Hasegawa, M.; Scheres, S.H.W.; Goedert, M.",√,human_ex_vivo,multiple system atrophy,human putamen,P,,EMD-10650,32461689.0,P37840,Homo sapiens (Human),,
6xyp,2,#e5885b,2.0,#e5845b,a-synuclein,Multiple system atrophy Type II-1 alpha-synuclein filament,14-99 (86),1/30/20,ELECTRON MICROSCOPY,3.29,"Schweighauser, M.; Shi, Y.; Tarutani, A.; Kametani, F.; Murzin, A.G.; Ghetti, B.; Matsubara, T.; Tomita, T.; Ando, T.; Hasegawa, K.; Murayama, S.; Yoshida, M.; Hasegawa, M.; Scheres, S.H.W.; Goedert, M.",√,human_ex_vivo,multiple system atrophy,human putamen,P,,EMD-10651,32461689.0,P37840,Homo sapiens (Human),,
6xyq,2,#e5885b,2.0,#e5845b,a-synuclein,Multiple system atrophy Type II-2 alpha-synuclein filament,14-99 (86),1/30/20,ELECTRON MICROSCOPY,3.09,"Schweighauser, M.; Shi, Y.; Tarutani, A.; Kametani, F.; Murzin, A.G.; Ghetti, B.; Matsubara, T.; Tomita, T.; Ando, T.; Hasegawa, K.; Murayama, S.; Yoshida, M.; Hasegawa, M.; Scheres, S.H.W.; Goedert, M.",√,human_ex_vivo,multiple system atrophy,human putamen,P,,EMD-10652,32461689.0,P37840,Homo sapiens (Human),,
7c1d,2,#e5885b,9.0,#b9e55b,a-synuclein,Cryo-EM structure of the hE46K cross-seeded hWT alpha-synuclein fibril,46-96 (51),5/3/20,ELECTRON MICROSCOPY,3.8,"Long, H.; Zheng, W.; Liu, Y.; Sun, Y.; Zhao, K.; Liu, Z.; Xia, W.; Lv, S.; Liu, Z.; Li, D.; He, K.W.; Liu, C.",,seeded_amplified,,Seeded by h46K fibrils,P,,EMD-30269,33972418.0,P37840,Homo sapiens (Human),,
7lc9,2,#e5885b,0.0,#e55b5b,a-synuclein,Cryo-EM structure of the N-terminal alpha-synuclein truncation 41-140,46-98 (53),1/10/21,ELECTRON MICROSCOPY,3.2,"McGlinchey, R.P.; Ni, X.; Shadish, J.A.; Jiang, J.; Lee, J.C.",,in_vitro,,,P,,EMD-23270,34452994.0,P37840,Homo sapiens (Human),,d1-41
7nca,2,#e5885b,3.0,#e5985b,a-synuclein,Type 1A alpha-synuclein filament seeded in vitro by filaments purified from Multiple Systems Atrophy Case 2,37-97 (61),1/28/21,ELECTRON MICROSCOPY,3.47,"Lovestam, S.; Schweighauser, M.; Matsubara, T.; Murayama, S.; Tomita, T.; Ando, T.; Hasegawa, K.; Yoshida, M.; Tarutani, A.; Hasegawa, M.; Goedert, M.; Scheres, S.H.W.",,seeded_amplified,MSA (putamen),Seeded,P,,EMD-12264,33548114.0,P37840,Homo sapiens (Human),,
7ncg,2,#e5885b,3.0,#e5985b,a-synuclein,Type 2A alpha-synuclein filament seeded in vitro by filaments purified from Multiple Systems Atrophy Case 2,37-97 (61),1/28/21,ELECTRON MICROSCOPY,3.43,"Lovestam, S.; Schweighauser, M.; Matsubara, T.; Murayama, S.; Tomita, T.; Ando, T.; Hasegawa, K.; Yoshida, M.; Tarutani, A.; Hasegawa, M.; Goedert, M.; Scheres, S.H.W.",,seeded_amplified,MSA putamen (Case 2),Seeded,P,,EMD-12265,33548114.0,P37840,Homo sapiens (Human),,
7nch,2,#e5885b,3.0,#e5985b,a-synuclein,Type 1B alpha-synuclein filament seeded in vitro by filaments purified from Multiple Systems Atrophy Case 1,14-25; 36-91 (68),1/28/21,ELECTRON MICROSCOPY,3.84,"Lovestam, S.; Schweighauser, M.; Matsubara, T.; Murayama, S.; Tomita, T.; Ando, T.; Hasegawa, K.; Yoshida, M.; Tarutani, A.; Hasegawa, M.; Goedert, M.; Scheres, S.H.W.",,seeded_amplified,MSA Case 1 (putamen),Seeded,P,,EMD-12266,33548114.0,P37840,Homo sapiens (Human),,
7nci,2,#e5885b,3.0,#e5985b,a-synuclein,Type 2B alpha-synuclein filament seeded in vitro by filaments purified from Multiple Systems Atrophy Case 1,14-25; 36-91 (68),1/28/21,ELECTRON MICROSCOPY,3.55,"Lovestam, S.; Schweighauser, M.; Matsubara, T.; Murayama, S.; Tomita, T.; Ando, T.; Hasegawa, K.; Yoshida, M.; Tarutani, A.; Hasegawa, M.; Goedert, M.; Scheres, S.H.W.",,seeded_amplified,MSA Case 1 (putamen),Seeded,P,,EMD-12267,33548114.0,P37840,Homo sapiens (Human),,
7ncj,2,#e5885b,3.0,#e5985b,a-synuclein,Type 2AB alpha-synuclein filament seeded in vitro by filaments purified from Multiple Systems Atrophy Case 1,14-25; 36-97 (74),1/28/21,ELECTRON MICROSCOPY,4.23,"Lovestam, S.; Schweighauser, M.; Matsubara, T.; Murayama, S.; Tomita, T.; Ando, T.; Hasegawa, K.; Yoshida, M.; Tarutani, A.; Hasegawa, M.; Goedert, M.; Scheres, S.H.W.",,seeded_amplified,MSA Case 1 (putamen),Seeded,P,,EMD-12268,33548114.0,P37840,Homo sapiens (Human),,
7nck,2,#e5885b,2.0,#e5845b,a-synuclein,Type 3 alpha-synuclein filament seeded in vitro by filaments purified from Multiple Systems Atrophy Case 5,36-99 (64),1/28/21,ELECTRON MICROSCOPY,3.18,"Lovestam, S.; Schweighauser, M.; Matsubara, T.; Murayama, S.; Tomita, T.; Ando, T.; Hasegawa, K.; Yoshida, M.; Tarutani, A.; Hasegawa, M.; Goedert, M.; Scheres, S.H.W.",,seeded_amplified,MSA putamen (Case 5),Seeded,P,,EMD-12269,33548114.0,P37840,Homo sapiens (Human),,
7ozg,2,#e5885b,3.0,#e5985b,a-synuclein,"PMCA-amplified alpha-synuclein fibril polymorph, Parkinson's Disease patient-derived seeds",14-25; 36-96 (73),6/28/21,ELECTRON MICROSCOPY,3.3,"Frieg, B.; Geraets, J.A.; Strohaeker, T.; Dienemann, C.; Mavroeidi, P.; Jung, B.C.; Woojin, S.K.; Lee, S.-J.; Xilouri, M.; Zweckstetter, M.; Schroeder, G.F.",,seeded_amplified,Parkinson's Disease patient-derived seeds,Amplified,P,,EMD-13123,,P37840,Homo sapiens (Human),,
7ozh,2,#e5885b,3.0,#e5985b,a-synuclein,"PMCA-amplified alpha-synuclein fibril polymorph, Multiple System Atrophy patient-derived seeds",36-93 (58),6/28/21,ELECTRON MICROSCOPY,3.02,"Frieg, B.; Geraets, J.A.; Strohaeker, T.; Dienemann, C.; Mavroeidi, P.; Jung, B.C.; Woojin, S.K.; Lee, S.-J.; Xilouri, M.; Zweckstetter, M.; Schroeder, G.F.",,seeded_amplified,Multiple System Atrophy patient-derived seeds,Amplified,P,,EMD-13124,,P37840,Homo sapiens (Human),,
7uak,2,#e5885b,2.0,#e5845b,a-synuclein,Structure of recombinantly assembled A53E alpha-synuclein fibrils,38-99 (62),3/13/22,ELECTRON MICROSCOPY,3.38,"Sun, C.; Zhou, K.; DePaola IV, P.; Shin, W.S.; Hillyer, T.; Sawaya, M.R.; Zhu, R.; Peng, C.; Zhou, Z.H.; Jiang, L.",,in_vitro,,,P,,EMD-26427,36871760.0,P37840,Homo sapiens (Human),A53E,
7v47,2,#e5885b,3.0,#e5985b,a-synuclein,Type 1A alpha-synuclein fibril seeded by cerebrospinal fluid from a preclinical Parkinson's disease patient,36-96 (61),8/12/21,ELECTRON MICROSCOPY,2.8,"Fan, Y.; Sun, Y.; Yu, W.; Tao, Y.; Xia, W.; Liu, Y.; Zhao, Q.; Tang, Y.; Sun, Y.; Liu, F.; Cao, Q.; Wu, J.; Liu, C.; Wang, J.; Li, D.",,seeded_amplified,CSF (preclinical Parkinson's disease patient),Amplified,P,,EMD-31702,36513068.0,P37840,Homo sapiens (Human),,
7v48,2,#e5885b,3.0,#e5985b,a-synuclein,Type 1D alpha-synuclein fibril seeded by cerebrospinal fluid from a postmortal Parkinson's disease patient,36-98 (63),8/12/21,ELECTRON MICROSCOPY,3.0,"Fan, Y.; Sun, Y.; Yu, W.; Tao, Y.; Xia, W.; Liu, Y.; Zhao, Q.; Tang, Y.; Sun, Y.; Liu, F.; Cao, Q.; Wu, J.; Liu, C.; Wang, J.; Li, D.",,seeded_amplified,CSF (postmortal Parkinson's disease patient),Amplified,P,,EMD-31703,36513068.0,P37840,Homo sapiens (Human),,
7v49,2,#e5885b,2.0,#e5845b,a-synuclein,Type 4 alpha-synuclein fibril seeded by cerebrospinal fluid from a postmortal Parkinson's disease patient,36-95 (60),8/12/21,ELECTRON MICROSCOPY,3.4,"Fan, Y.; Sun, Y.; Yu, W.; Tao, Y.; Xia, W.; Liu, Y.; Zhao, Q.; Tang, Y.; Sun, Y.; Liu, F.; Cao, Q.; Wu, J.; Liu, C.; Wang, J.; Li, D.",,seeded_amplified,CSF (postmortal late-PD patient),PMCA-amplified,P,,EMD-31704,36513068.0,P37840,Homo sapiens (Human),,
7v4a,2,#e5885b,3.0,#e5985b,a-synuclein,Heparin-induced alpha-synuclein fibrils polymorph 1,14-25; 32-99 (80),8/12/21,ELECTRON MICROSCOPY,3.2,"Tao, Y.Q.; Sun, Y.P.; Liu, C.; Li, D.",,in_vitro,,,P,,EMD-31705,,P37840,Homo sapiens (Human),,
7v4b,2,#e5885b,3.0,#e5985b,a-synuclein,Heparin-induced alpha-synuclein fibrils polymorph 3,14-25; 32-99 (80),8/12/21,ELECTRON MICROSCOPY,3.1,"Tao, Y.Q.; Sun, Y.P.; Liu, C.; Li, D.",,in_vitro,,,P,,EMD-31706,,P37840,Homo sapiens (Human),,
7v4c,2,#e5885b,2.0,#e5845b,a-synuclein,Heparin-induced alpha-synuclein fibrils polymorph 4,37-98 (62),8/12/21,ELECTRON MICROSCOPY,3.3,"Tao, Y.Q.; Sun, Y.P.; Liu, C.; Li, D.",,in_vitro,,,P,,EMD-31707,,P37840,Homo sapiens (Human),,
7v4d,2,#e5885b,2.0,#e5845b,a-synuclein,Heparin-remodelled alpha-synuclein fibrils,37-94 (58),8/12/21,ELECTRON MICROSCOPY,3.5,"Tao, Y.Q.; Sun, Y.P.; Xia, W.C.; Zhao, Q.Y.; Liu, C.; Li, D.",,in_vitro,,,P,,EMD-31708,,P37840,Homo sapiens (Human),,
7wmm,2,#e5885b,2.0,#e5845b,a-synuclein,alpha-synuclein fibril-F0502B complex,37-97 (61),1/15/22,ELECTRON MICROSCOPY,2.6,"Tao, Y.Q.; Zhao, Q.Y.; Liu, C.; Li, D.",,in_vitro,,,P,,EMD-32615,,P37840,Homo sapiens (Human),,
7wnz,2,#e5885b,2.0,#e5845b,a-synuclein,CryoEM structure of human alpha-synuclein A53T fibril,36-100 (65),1/20/22,ELECTRON MICROSCOPY,3.4,"Huang, J.Y.-C.; Wu, K.-P.",,in_vitro,,,P,,EMD-32636,,P37840,Homo sapiens (Human),A53T,
7wo0,2,#e5885b,3.0,#e5985b,a-synuclein,CryoEM structure of human alpha-synuclein A53T fibril induced by calcium ions,35-99 (65),1/20/22,ELECTRON MICROSCOPY,2.7,"Huang, J.Y.-C.; Wu, K.-P.",,in_vitro,,,P,,EMD-32637,,P37840,Homo sapiens (Human),A53T,
7xjx,2,#e5885b,2.0,#e5845b,a-synuclein,The cryo-EM structure of Fe3+ induced alpha-syn fibril.,37-99 (63),4/18/22,ELECTRON MICROSCOPY,2.7,"Zhao, Q.; Tao, Y.; Zhao, K.; Ma, Y.; Xu, Q.; Liu, C.; Zhang, S.; Li, D.",,in_vitro,,,P,,EMD-33236,,P37840,Homo sapiens (Human),,
7xo0,2,#e5885b,3.0,#e5985b,a-synuclein,Minor polymorph inalpha-synuclein fibril seeded by cerebrospinal fluid from a mid-to-late stage (mid-PD-1) Parkinson's disease patient,36-97 (62),4/30/22,ELECTRON MICROSCOPY,3.0,"Fan, Y.; Sun, Y.; Yu, W.; Tao, Y.; Xia, W.; Liu, Y.; Zhao, Q.; Tang, Y.; Sun, Y.; Liu, F.; Cao, Q.; Wu, J.; Liu, C.; Wang, J.; Li, D.",,seeded_amplified,,Amplified from CSF (mid-PD-1 patient),P,,EMD-33332,36513068.0,P37840,Homo sapiens (Human),,
7xo1,2,#e5885b,3.0,#e5985b,a-synuclein,Major polymorph in alpha-synuclein fibril seeded by cerebrospinal fluid from a mid-to-late stage (mid-PD-1) Parkinson's disease patient,36-97 (62),4/30/22,ELECTRON MICROSCOPY,3.0,"Fan, Y.; Sun, Y.; Yu, W.; Tao, Y.; Xia, W.; Liu, Y.; Zhao, Q.; Tang, Y.; Sun, Y.; Liu, F.; Cao, Q.; Wu, J.; Liu, C.; Wang, J.; Li, D.",,seeded_amplified,,Amplified from CSF (mid-PD-1 Parkinson's disease patient),P,,EMD-33333,36513068.0,P37840,Homo sapiens (Human),,
