id,cluster_thermodynamics,cluster_color_thermodynamics,cluster,cluster_color,Protein,Structure Title,Residues (Length),Dep. Date,Exp_Method,Resolution,Authors,From Patient,Sample origin,Disease,Tissue,Role (P/F/S),BMRB,EMDB,PubMed,UniProt,Organism,Mutation,Modification
6w0o,3,#e59e5b,4.0,#e5ac5b,Abeta40,Amyloid-beta(1-40) fibril derived from Alzheimer's disease cortical tissue,10-40 (31),3/2/20,"ELECTRON MICROSCOPY, SOLID-STATE NMR",2.77,"Ghosh, U.; Thurber, K.R.; Yau, W.M.; Tycko, R.",,seeded_amplified,Alzheimer's disease ,"Seeded by AD patient cortical tissue (parietal lobe, patient t-AD3)",P,30731,EMD-21501,33431654.0,P05067,Homo sapiens (Human),,
7f29,3,#e59e5b,0.0,#e55b5b,Abeta42,Cryo-EM structure of the fibril formed by disaccharide-modified amyloid-beta(1-42),6-42 (37),6/10/21,ELECTRON MICROSCOPY,3.1,"Liu, D.; Wei, Q.; Xia, W.; He, C.; Zhang, Q.; Huang, L.; Wang, X.; Sun, Y.; Ma, Y.; Zhang, X.; Wang, Y.; Shi, X.; Liu, C.; Dong, S.",,in_vitro,,,P,,EMD-31428,34841862.0,P05067,Homo sapiens (Human),,gY10
7q4b,3,#e59e5b,0.0,#e55b5b,Abeta42,Type I beta-amyloid 42 Filaments from Human Brain,9-42 (34),10/30/21,ELECTRON MICROSCOPY,2.5,"Yang, Y.; Arseni, D.; Zhang, W.; Huang, M.; Lovestam, S.; Schweighauser, M.; Kotecha, A.; Murzin, A.G.; Peak-Chew, S.Y.; Macdonald, J.; Lavenir, I.; Garringer, H.J.; Gelpi, E.; Newell, K.L.; Kovacs, G.G.; Vidal, R.; Ghetti, B.; Ryskeldi-Falcon, B.; Scheres, S.H.W.; Goedert, M.",√,human_ex_vivo,Alzheimer's disease,human brain (frontal cortex),P,,EMD-13800,35025654.0,P05067,Homo sapiens (Human),,
7q4m,3,#e59e5b,0.0,#e55b5b,Abeta42,Type II beta-amyloid 42 Filaments from Human Brain,12-42 (31),11/1/21,ELECTRON MICROSCOPY,2.8,"Yang, Y.; Arseni, D.; Zhang, W.; Huang, M.; Lovestam, S.; Schweighauser, M.; Kotecha, A.; Murzin, A.G.; Peak-Chew, S.Y.; Macdonald, J.; Lavenir, I.; Garringer, H.J.; Gelpi, E.; Newell, K.L.; Kovacs, G.G.; Vidal, R.; Ghetti, B.; Ryskeldi-Falcon, B.; Scheres, S.H.W.; Goedert, M.",√,human_ex_vivo,Alzheimer's disease,human brain (frontal cortex),P,,EMD-13809,35025654.0,P05067,Homo sapiens (Human),,
7q64,3,#e59e5b,0.0,#e55b5b,Nup98,Cryo-em structure of the Nup98 fibril polymorph 1,85-124 (40),11/5/21,ELECTRON MICROSCOPY,2.76,"Ibanez de Opakua, A.; Geraets, J.A.; Frieg, B.; Dienemann, C.; Savastano, A.; Rankovic, M.; Cima-Omori, M.S.; Schroder, G.F.; Zweckstetter, M.",,in_vitro,,,F,,EMD-13851,36138110.0,P52948,Homo sapiens (Human),,
7q65,3,#e59e5b,-1.0,#7f7f7f,Nup98,Cryo-em structure of the Nup98 fibril polymorph 2,85-124 (40),11/5/21,ELECTRON MICROSCOPY,3.32,"Ibanez de Opakua, A.; Geraets, J.A.; Frieg, B.; Dienemann, C.; Savastano, A.; Rankovic, M.; Cima-Omori, M.S.; Schroder, G.F.; Zweckstetter, M.",,in_vitro,,,F,,EMD-13852,36138110.0,P52948,Homo sapiens (Human),,
7q66,3,#e59e5b,0.0,#e55b5b,Nup98,Cryo-em structure of the Nup98 fibril polymorph 3,85-121 (37),11/5/21,ELECTRON MICROSCOPY,2.79,"Ibanez de Opakua, A.; Geraets, J.A.; Frieg, B.; Dienemann, C.; Savastano, A.; Rankovic, M.; Cima-Omori, M.S.; Schroder, G.F.; Zweckstetter, M.",,in_vitro,,,F,,EMD-13853,36138110.0,P52948,Homo sapiens (Human),,
7rl4,3,#e59e5b,0.0,#e55b5b,PrP,Cryo-EM structure of human PrP23-144 amyloid fibrils,108-141 (34),7/23/21,ELECTRON MICROSCOPY,2.86,"Li, Q.; Jaroniec, C.P.; Surewicz, W.K.",,in_vitro,,,P,,EMD-24514,36097290.0,P04156,Homo sapiens (Human),,Y145Stop
7xm8,3,#e59e5b,-1.0,#7f7f7f,Glucagon,Glucagon amyloid fibril,1-29 (29),4/25/22,ELECTRON MICROSCOPY,3.9,"Jeong, H.; Lee, Y.",,in_vitro,,,P,,EMD-33290,,P01275,Homo sapiens (Human),,
8azs,3,#e59e5b,0.0,#e55b5b,Abeta42,Type I amyloid-beta 42 filaments from high-spin supernatants of aqueous extracts from Alzheimer's disease brains | ABeta42,9-42 (34),9/6/22,ELECTRON MICROSCOPY,2.9,"Stern, A.M.; Yang, Y.; Jin, S.; Yamashita, K.; Meunier, A.L.; Liu, W.; Cai, Y.; Ericsson, M.; Liu, L.; Goedert, M.; Scheres, S.H.W.; Selkoe, D.J.",√,human_ex_vivo,Alzheimer's disease,"human brain (frontal, parietal, and temporal cortex)",P,,EMD-15770,37167969.0,P05067,Homo sapiens (Human),,
8azt,3,#e59e5b,0.0,#e55b5b,Abeta42,Type II amyloid-beta 42 filaments from high-spin supernatants of aqueous extracts from Alzheimer's disease brains | ABeta42,12-42 (31),9/6/22,ELECTRON MICROSCOPY,3.7,"Stern, A.M.; Yang, Y.; Jin, S.; Yamashita, K.; Meunier, A.L.; Liu, W.; Cai, Y.; Ericsson, M.; Liu, L.; Goedert, M.; Scheres, S.H.W.; Selkoe, D.J.",√,human_ex_vivo,Alzheimer's disease,human Alzheimer's disease brain cortex (aqueous soaking extract supernatant),P,,EMD-15771,37167969.0,P05067,Homo sapiens (Human),,
8bfa,3,#e59e5b,0.0,#e55b5b,Abeta42,Sarkosyl-extracted AppNL-G-F Abeta42 fibril structure,1-38 (38),10/24/22,ELECTRON MICROSCOPY,3.0,"Leistner, C.; Wilkinson, M.; Burgess, A.; Lovatt, M.; Goodbody, S.; Xu, Y.; Deuchars, S.; Radford, S.E.; Ranson, N.A.; Frank, R.A.W.",,animal_ex_vivo,,AppNL-G-F mouse forebrain (cortex and hippocampus),P,,EMD-16018,37198197.0,P05067,Homo sapiens (Human),E22G,
8bfb,3,#e59e5b,0.0,#e55b5b,Abeta42,Sarkosyl-extracted AppNL-G-F Abeta42 fibril structure (Methoxy-X04-labelled mice),1-38 (38),10/24/22,ELECTRON MICROSCOPY,3.2,"Leistner, C.; Wilkinson, M.; Burgess, A.; Lovatt, M.; Goodbody, S.; Xu, Y.; Deuchars, S.; Radford, S.E.; Ranson, N.A.; Frank, R.A.W.",,animal_ex_vivo,,"AppNL-G-F mouse forebrain (cortex and hippocampus), Methoxy-X04-labelled",P,,EMD-16019,37198197.0,P05067,Homo sapiens (Human),E22G,
8bfz,3,#e59e5b,0.0,#e55b5b,Abeta42,Amyloid-beta 42 filaments extracted from the human brain with Arctic mutation (E22G) of Alzheimer's disease | ABeta42,12-42 (31),10/27/22,ELECTRON MICROSCOPY,2.8,"Yang, Y.; Zhang, W.; Murzin, A.G.; Schweighauser, M.; Huang, M.; Lovestam, S.; Peak-Chew, S.Y.; Saito, T.; Saido, T.C.; Macdonald, J.; Lavenir, I.; Ghetti, B.; Graff, C.; Kumar, A.; Nordberg, A.; Goedert, M.; Scheres, S.H.W.",√,human_ex_vivo,Alzheimer's disease,human frontal cortex (case A_PParc1),P,,EMD-16022,36611124.0,P05067,Homo sapiens (Human),E22G,
8bg0,3,#e59e5b,0.0,#e55b5b,Abeta40,Amyloid-beta tetrameric filaments with the Arctic mutation (E22G) from Alzheimer's disease brains | ABeta40,11-37 (27); 12-40 (29),10/27/22,ELECTRON MICROSCOPY,1.99,"Yang, Y.; Zhang, W.; Murzin, A.G.; Schweighauser, M.; Huang, M.; Lovestam, S.; Peak-Chew, S.Y.; Saito, T.; Saido, T.C.; Macdonald, J.; Lavenir, I.; Ghetti, B.; Graff, C.; Kumar, A.; Nordberg, A.; Goedert, M.; Scheres, S.H.W.",√,human_ex_vivo,Alzheimer's disease,human frontal cortex,P,,EMD-16023,36611124.0,P05067,Homo sapiens (Human),E22G,
8bg9,3,#e59e5b,0.0,#e55b5b,Abeta40,Murine amyloid-beta filaments with the Arctic mutation (E22G) from APP(NL-G-F) mouse brains | ABeta,1-37 (37),10/27/22,ELECTRON MICROSCOPY,3.5,"Yang, Y.; Zhang, W.; Murzin, A.G.; Schweighauser, M.; Huang, M.; Lovestam, S.; Peak-Chew, S.Y.; Saito, T.; Saido, T.C.; Macdonald, J.; Lavenir, I.; Ghetti, B.; Graff, C.; Kumar, A.; Nordberg, A.; Goedert, M.; Scheres, S.H.W.",,animal_ex_vivo,,AppNL-G-F mouse brain,P,,EMD-16027,36611124.0,P12023,Mus musculus (Mouse),E22G,
8dja,3,#e59e5b,0.0,#e55b5b,PrP,Cryo-EM structure of mouse PrP23-144 amyloid fibrils (polymorph 1),108-141 (34),6/30/22,ELECTRON MICROSCOPY,3.92,"Li, Q.; Jaroniec, C.P.; Surewicz, W.K.",,in_vitro,,,P,,EMD-27458,36097290.0,P04925,Mus musculus (Mouse),,
8ezd,3,#e59e5b,-1.0,#7f7f7f,Abeta42,Brain-derived 42-residue amyloid-beta fibril type A,12-42 (31),10/31/22,ELECTRON MICROSCOPY,2.83,"Lee, M.; Yau, W.M.; Louis, J.M.; Tycko, R.",,seeded_amplified,,Seeded by AD patient parietal lobe brain tissue,P,,EMD-28740,36893281.0,P05067,Homo sapiens (Human),,
8eze,3,#e59e5b,4.0,#e5ac5b,Abeta42,Brain-derived 42-residue amyloid-beta fibril type B,1-42 (42),10/31/22,ELECTRON MICROSCOPY,2.76,"Lee, M.; Yau, W.M.; Louis, J.M.; Tycko, R.",,seeded_amplified,,Seeded by AD patient parietal lobe tissue (second-generation brain-seeded),P,,EMD-28741,36893281.0,P05067,Homo sapiens (Human),,
8ff2,3,#e59e5b,0.0,#e55b5b,Abeta40,Amyloid-beta (1-40) fibrils derived from a CAA patient,1-38 (38),12/7/22,ELECTRON MICROSCOPY,2.87,"Fu, Z.; Crooks, E.J.; Irizarry, B.A.; Zhu, X.; Chowdhury, S.; Van Nostrand, W.E.; Smith, S.O.",,seeded_amplified,,Seeded by sCAA patient (cerebral vasculature),P,,EMD-29036,38615725.0,P05067,Homo sapiens (Human),,
8ff3,3,#e59e5b,4.0,#e5ac5b,Abeta40,Amyloid-beta (1-40) fibrils derived from familial Dutch-type CAA patient (population B),15-39 (25),12/7/22,ELECTRON MICROSCOPY,3.09,"Fu, Z.; Crooks, E.J.; Irizarry, B.A.; Zhu, X.; Chowdhury, S.; Van Nostrand, W.E.; Smith, S.O.",,seeded_amplified,,Seeded by fCAA-Dutch patient vascular amyloid,P,,EMD-29037,38615725.0,P05067,Homo sapiens (Human),,
8ib0,3,#e59e5b,0.0,#e55b5b,RIPK1,The amyloid structure of mouse RIPK1 RHIM-containing domain by solid-state NMR,516-539 (24),2/9/23,SOLID-STATE NMR,,"Liu, J.; Wu, X.L.; Zhang, J.; Li, B.; Wang, H.Y.; Wang, J.; Lu, J.X.",,in_vitro,,,F,36547,,39143113.0,Q60855,Mus musculus (Mouse),,
8j47,3,#e59e5b,4.0,#e5ac5b,Abeta40,CryoEM Structure of 40-Residue Arctic (E22G) Beta-Amyloid Fibril Derived by Co-Analysis with Solid-State NMR | E22G Abeta40,12-40 (28),4/19/23,ELECTRON MICROSCOPY,2.5,"Tehrani, M.J.; Matsuda, I.; Yamagata, A.; Kodama, Y.; Matsunaga, T.; Sato, M.; Toyooka, K.; McElheny, D.; Kobayashi, N.; Shirouzu, M.; Ishii, Y.",,in_vitro,,,P,,EMD-35972,39147751.0,P05067,Homo sapiens (Human),E22G,
8kew,3,#e59e5b,0.0,#e55b5b,Abeta42,The cryo-EM structure of type1 amyloid beta 42 fibril.,9-42 (34),8/13/23,ELECTRON MICROSCOPY,3.3,"Zhao, Q.Y.; Tao, Y.Q.; Liu, C.; Li, D.",,in_vitro,,,P,,EMD-37170,,P05067,Homo sapiens (Human),,
8kf1,3,#e59e5b,0.0,#e55b5b,Abeta42,The cryo-EM structure of AV-45 bound type1 amyloid beta 42 fibril.,9-42 (34),8/15/23,ELECTRON MICROSCOPY,3.3,"Zhao, Q.Y.; Tao, Y.Q.; Liu, C.; Li, D.",,in_vitro,,,P,,EMD-37195,,P05067,Homo sapiens (Human),,
8kf3,3,#e59e5b,0.0,#e55b5b,Abeta42,The cryo-EM structure of type3 amyloid beta 42 fibril.,12-42 (31); 9-42 (34),8/15/23,ELECTRON MICROSCOPY,3.5,"Zhao, Q.Y.; Tao, Y.Q.; Liu, C.; Li, D.",,in_vitro,,,P,,EMD-37197,,P05067,Homo sapiens (Human),,
8kf4,3,#e59e5b,0.0,#e55b5b,Abeta42,The cryo-EM structure of type1 amyloid beta 42 fibril in AD2 patient.,9-42 (34),8/15/23,ELECTRON MICROSCOPY,3.0,"Zhao, Q.Y.; Tao, Y.Q.; Liu, C.; Li, D.",√,human_ex_vivo,Alzheimer's disease,AD2 patient,P,,EMD-37198,,P05067,Homo sapiens (Human),,
8kf5,3,#e59e5b,0.0,#e55b5b,Abeta42,The cryo-EM structure of type1 amyloid beta 42 fibril in AD3.,9-42 (34),8/15/23,ELECTRON MICROSCOPY,3.4,"Zhao, Q.Y.; Tao, Y.Q.; Liu, C.; Li, D.",√,human_ex_vivo,Alzheimer's disease,AD3,P,,EMD-37199,,P05067,Homo sapiens (Human),,
8kf6,3,#e59e5b,0.0,#e55b5b,Abeta42,The cryo-EM structure of AV-45 bound type3 amyloid beta 42 fibril.,12-42 (31); 9-42 (34),8/15/23,ELECTRON MICROSCOPY,3.7,"Zhao, Q.Y.; Tao, Y.Q.; Liu, C.; Li, D.",,in_vitro,,,P,,EMD-37200,,P05067,Homo sapiens (Human),,
8oh2,3,#e59e5b,4.0,#e5ac5b,Tau,Structure of the Tau-PAM4 Type 1 amyloid fibril,305-362 (13),3/20/23,ELECTRON MICROSCOPY,2.6,"Louros, N.; Wilkinson, M.; Tsaka, G.; Ramakers, M.; Morelli, C.; Garcia, T.; Gallardo, R.; D'Haeyer, S.; Goossens, V.; Audenaert, D.; Thal, D.R.; Mackenzie, I.R.; Rademakers, R.; Ranson, N.A.; Radford, S.E.; Rousseau, F.; Schymkowitz, J.",,in_vitro,,,P,,EMD-16876,38310108.0,P10636,Homo sapiens (Human),,
8ohi,3,#e59e5b,4.0,#e5ac5b,Tau,Structure of the Fmoc-Tau-PAM4 Type 2 amyloid fibril,305-362 (13),3/21/23,ELECTRON MICROSCOPY,2.8,"Louros, N.; Wilkinson, M.; Tsaka, G.; Ramakers, M.; Morelli, C.; Garcia, T.; Gallardo, R.; D'Haeyer, S.; Goossens, V.; Audenaert, D.; Thal, D.R.; Mackenzie, I.R.; Rademakers, R.; Ranson, N.A.; Radford, S.E.; Rousseau, F.; Schymkowitz, J.",,in_vitro,,,P,,EMD-16881,38310108.0,P10636,Homo sapiens (Human),,
8ohp,3,#e59e5b,4.0,#e5ac5b,Tau,Structure of the Fmoc-Tau-PAM4 Type 3 amyloid fibril,305-362 (13),3/21/23,ELECTRON MICROSCOPY,2.7,"Louros, N.; Wilkinson, M.; Tsaka, G.; Ramakers, M.; Morelli, C.; Garcia, T.; Gallardo, R.; D'Haeyer, S.; Goossens, V.; Audenaert, D.; Thal, D.R.; Mackenzie, I.R.; Rademakers, R.; Ranson, N.A.; Radford, S.E.; Rousseau, F.; Schymkowitz, J.",,in_vitro,,,P,,EMD-16883,38310108.0,P10636,Homo sapiens (Human),,
8oi0,3,#e59e5b,4.0,#e5ac5b,Tau,Structure of the Fmoc-Tau-PAM4 Type 4 amyloid fibril,305-362 (13),3/21/23,ELECTRON MICROSCOPY,2.9,"Louros, N.; Wilkinson, M.; Tsaka, G.; Ramakers, M.; Morelli, C.; Garcia, T.; Gallardo, R.; D'Haeyer, S.; Goossens, V.; Audenaert, D.; Thal, D.R.; Mackenzie, I.R.; Rademakers, R.; Ranson, N.A.; Radford, S.E.; Rousseau, F.; Schymkowitz, J.",,in_vitro,,,P,,EMD-16886,38310108.0,P10636,Homo sapiens (Human),,
8ol2,3,#e59e5b,0.0,#e55b5b,Abeta42,Murine type II Abeta fibril from APP23 mouse,12-42 (31),3/30/23,ELECTRON MICROSCOPY,3.0,"Zielinski, M.; Peralta Reyes, F.S.; Gremer, L.; Schemmert, S.; Frieg, B.; Schafer, L.U.; Willuweit, A.; Donner, L.; Elvers, M.; Nilsson, L.N.G.; Syvanen, S.; Sehlin, D.; Ingelsson, M.; Willbold, D.; Schroder, G.F.",,animal_ex_vivo,,APP23 mouse brain,P,,EMD-16942,37973869.0,P05067,Homo sapiens (Human),,
8ol3,3,#e59e5b,0.0,#e55b5b,Abeta42,Murine type III Abeta fibril from APP/PS1 mouse,10-42 (33),3/30/23,ELECTRON MICROSCOPY,3.5,"Zielinski, M.; Peralta Reyes, F.S.; Gremer, L.; Schemmert, S.; Frieg, B.; Schafer, L.U.; Willuweit, A.; Donner, L.; Elvers, M.; Nilsson, L.N.G.; Syvanen, S.; Sehlin, D.; Ingelsson, M.; Willbold, D.; Schroder, G.F.",,animal_ex_vivo,,APP/PS1 mouse brain,P,,EMD-16944,37973869.0,P05067,Homo sapiens (Human),,
8ol5,3,#e59e5b,0.0,#e55b5b,Abeta42,Murine type II Abeta fibril from ARTE10 mouse,12-42 (31),3/30/23,ELECTRON MICROSCOPY,3.4,"Zielinski, M.; Peralta Reyes, F.S.; Gremer, L.; Schemmert, S.; Frieg, B.; Schafer, L.U.; Willuweit, A.; Donner, L.; Elvers, M.; Nilsson, L.N.G.; Syvanen, S.; Sehlin, D.; Ingelsson, M.; Willbold, D.; Schroder, G.F.",,animal_ex_vivo,,ARTE10 mouse brain,P,,EMD-16949,37973869.0,P05067,Homo sapiens (Human),,
8ol6,3,#e59e5b,0.0,#e55b5b,Abeta42,Murine type II Abeta fibril from tgAPPSwe mouse,12-42 (31),3/30/23,ELECTRON MICROSCOPY,3.8,"Zielinski, M.; Peralta Reyes, F.S.; Gremer, L.; Schemmert, S.; Frieg, B.; Schafer, L.U.; Willuweit, A.; Donner, L.; Elvers, M.; Nilsson, L.N.G.; Syvanen, S.; Sehlin, D.; Ingelsson, M.; Willbold, D.; Schroder, G.F.",,animal_ex_vivo,,tgAPPSwe mouse brain,P,,EMD-16952,37973869.0,P05067,Homo sapiens (Human),,
8ol7,3,#e59e5b,0.0,#e55b5b,Abeta42,MurineArc type I Abeta fibril from tg-APPArcSwe mouse,9-40 (32),3/30/23,ELECTRON MICROSCOPY,3.0,"Zielinski, M.; Peralta Reyes, F.S.; Gremer, L.; Schemmert, S.; Frieg, B.; Schafer, L.U.; Willuweit, A.; Donner, L.; Elvers, M.; Nilsson, L.N.G.; Syvanen, S.; Sehlin, D.; Ingelsson, M.; Willbold, D.; Schroder, G.F.",,animal_ex_vivo,,tg-APPArcSwe mouse brain,P,,EMD-16953,37973869.0,P05067,Homo sapiens (Human),E22G,
8olg,3,#e59e5b,0.0,#e55b5b,Abeta42,DI2 Abeta fibril from tg-SwDI mouse,1-39 (39),3/30/23,ELECTRON MICROSCOPY,4.2,"Zielinski, M.; Peralta Reyes, F.S.; Gremer, L.; Schemmert, S.; Frieg, B.; Schafer, L.U.; Willuweit, A.; Donner, L.; Elvers, M.; Nilsson, L.N.G.; Syvanen, S.; Sehlin, D.; Ingelsson, M.; Willbold, D.; Schroder, G.F.",,animal_ex_vivo,,tg-SwDI mouse brain,P,,EMD-16957,37973869.0,P05067,Homo sapiens (Human),"E22Q, D23N",
8oln,3,#e59e5b,0.0,#e55b5b,Abeta42,DI1 Abeta fibril from tg-SwDI mouse,1-36 (36),3/30/23,ELECTRON MICROSCOPY,3.3,"Zielinski, M.; Peralta Reyes, F.S.; Gremer, L.; Schemmert, S.; Frieg, B.; Schafer, L.U.; Willuweit, A.; Donner, L.; Elvers, M.; Nilsson, L.N.G.; Syvanen, S.; Sehlin, D.; Ingelsson, M.; Willbold, D.; Schroder, G.F.",,animal_ex_vivo,,tg-SwDI mouse brain,P,,EMD-16959,37973869.0,P05067,Homo sapiens (Human),"E22Q, D23N",
8olo,3,#e59e5b,0.0,#e55b5b,Abeta42,Murine type III Abeta fibril from ARTE10 mouse,10-40 (31),3/30/23,ELECTRON MICROSCOPY,3.5,"Zielinski, M.; Peralta Reyes, F.S.; Gremer, L.; Schemmert, S.; Frieg, B.; Schafer, L.U.; Willuweit, A.; Donner, L.; Elvers, M.; Nilsson, L.N.G.; Syvanen, S.; Sehlin, D.; Ingelsson, M.; Willbold, D.; Schroder, G.F.",,animal_ex_vivo,,ARTE10 mouse brain,P,,EMD-16960,37973869.0,P05067,Homo sapiens (Human),,
8olq,3,#e59e5b,0.0,#e55b5b,Abeta42,DI3 Abeta fibril from tg-SwDI mouse,2-33 (32),3/30/23,ELECTRON MICROSCOPY,4.0,"Zielinski, M.; Peralta Reyes, F.S.; Gremer, L.; Schemmert, S.; Frieg, B.; Schafer, L.U.; Willuweit, A.; Donner, L.; Elvers, M.; Nilsson, L.N.G.; Syvanen, S.; Sehlin, D.; Ingelsson, M.; Willbold, D.; Schroder, G.F.",,animal_ex_vivo,,tg-SwDI mouse brain,P,,EMD-16961,37973869.0,P05067,Homo sapiens (Human),"E22Q, D23N",
8ot1,3,#e59e5b,4.0,#e5ac5b,Abeta40,unseeded Abeta(1-40) amyloid fibril (morphology i),13-40 (28),4/20/23,ELECTRON MICROSCOPY,2.59,"Pfeiffer, P.B.; Ugrina, M.; Schwierz, N.; Sigurdson, C.J.; Schmidt, M.; Fandrich, M.",,in_vitro,,,P,,EMD-17166,38158175.0,P05067,Homo sapiens (Human),,
8ot3,3,#e59e5b,4.0,#e5ac5b,Abeta40,unseeded Abeta(1-40) amyloid fibril (morphology ii),13-40 (28),4/20/23,ELECTRON MICROSCOPY,2.73,"Pfeiffer, P.B.; Ugrina, M.; Schwierz, N.; Sigurdson, C.J.; Schmidt, M.; Fandrich, M.",,in_vitro,,,P,,EMD-17167,38158175.0,P05067,Homo sapiens (Human),,
8ot4,3,#e59e5b,0.0,#e55b5b,Abeta40,seeded Abeta(1-40) amyloid fibril (morphology I),1-37 (37),4/20/23,ELECTRON MICROSCOPY,2.97,"Pfeiffer, P.B.; Ugrina, M.; Schwierz, N.; Sigurdson, C.J.; Schmidt, M.; Fandrich, M.",,seeded_amplified,,Seeded by AD patient meningeal tissue,P,,EMD-17168,38158175.0,P05067,Homo sapiens (Human),,
8otf,3,#e59e5b,0.0,#e55b5b,Abeta42,Ab typeII filament from Guam ALS/PDC,12-42 (31),4/20/23,ELECTRON MICROSCOPY,3.3,"Qi, C.; Verheijen, B.M.; Kokubo, Y.; Shi, Y.; Tetter, S.; Murzin, A.G.; Nakahara, A.; Morimoto, S.; Vermulst, M.; Sasaki, R.; Aronica, E.; Hirokawa, Y.; Oyanagi, K.; Kakita, A.; Ryskeldi-Falcon, B.; Yoshida, M.; Hasegawa, M.; Scheres, S.H.W.; Goedert, M.",√,human_ex_vivo,amyotrophic lateral sclerosis/parkinsonism-dementia complex,Guam ALS/PDC human frontal cortex,P,,EMD-17177,38100415.0,P05067,Homo sapiens (Human),,
8ovk,3,#e59e5b,4.0,#e5ac5b,Abeta40,Lipidic amyloid-beta(1-40) fibril - polymorph L1,1-40 (40),4/26/23,ELECTRON MICROSCOPY,2.88,"Frieg, B.; Han, M.; Giller, K.; Dienemann, C.; Riedel, D.; Becker, S.; Andreas, L.B.; Griesinger, C.; Schroder, G.F.",,in_vitro,,,P,,EMD-17218,38351005.0,P05067,Homo sapiens (Human),,
8ovm,3,#e59e5b,13.0,#69e55b,Abeta40,Lipidic amyloid-beta(1-40) fibril - polymorph L2,5-40 (36),4/26/23,ELECTRON MICROSCOPY,3.24,"Frieg, B.; Han, M.; Giller, K.; Dienemann, C.; Riedel, D.; Becker, S.; Andreas, L.B.; Griesinger, C.; Schroder, G.F.",,in_vitro,,,P,,EMD-17223,38351005.0,P05067,Homo sapiens (Human),,
8owd,3,#e59e5b,13.0,#69e55b,Abeta40,Lipidic amyloid-beta(1-40) fibril - polymorph L3,1-40 (40),4/27/23,ELECTRON MICROSCOPY,3.28,"Frieg, B.; Han, M.; Giller, K.; Dienemann, C.; Riedel, D.; Becker, S.; Andreas, L.B.; Griesinger, C.; Schroder, G.F.",,in_vitro,,,P,,EMD-17234,38351005.0,P05067,Homo sapiens (Human),,
8owe,3,#e59e5b,13.0,#69e55b,Abeta40,Lipidic amyloid-beta(1-40) fibril - polymorph L2-L3,1-40 (40); 4-40 (37),4/27/23,ELECTRON MICROSCOPY,3.75,"Frieg, B.; Han, M.; Giller, K.; Dienemann, C.; Riedel, D.; Becker, S.; Andreas, L.B.; Griesinger, C.; Schroder, G.F.",,in_vitro,,,P,,EMD-17235,38351005.0,P05067,Homo sapiens (Human),,
8owj,3,#e59e5b,13.0,#69e55b,Abeta40,Lipidic amyloid-beta(1-40) fibril - polymorph L2-L2,5-40 (36),4/28/23,ELECTRON MICROSCOPY,3.75,"Frieg, B.; Han, M.; Giller, K.; Dienemann, C.; Riedel, D.; Becker, S.; Andreas, L.B.; Griesinger, C.; Schroder, G.F.",,in_vitro,,,P,,EMD-17238,38351005.0,P05067,Homo sapiens (Human),,
8owk,3,#e59e5b,13.0,#69e55b,Abeta40,Lipidic amyloid-beta(1-40) fibril - polymorph L3-L3,1-40 (40),4/28/23,ELECTRON MICROSCOPY,3.86,"Frieg, B.; Han, M.; Giller, K.; Dienemann, C.; Riedel, D.; Becker, S.; Andreas, L.B.; Griesinger, C.; Schroder, G.F.",,in_vitro,,,P,,EMD-17239,38351005.0,P05067,Homo sapiens (Human),,
8qn6,3,#e59e5b,0.0,#e55b5b,Abeta40,Amyloid-beta 40 type 2 filament from the leptomeninges of individual with Alzheimer's disease and cerebral amyloid angiopathy,1-38 (38),9/25/23,ELECTRON MICROSCOPY,2.4,"Yang, Y.; Murzin, A.G.; Peak-Chew, S.; Franco, C.; Garringer, H.J.; Newell, K.L.; Ghetti, B.; Goedert, M.; Scheres, S.H.W.",√,human_ex_vivo,Alzheimer's disease and cerebral amyloid angiopathy,human leptomeninges,P,,EMD-18508,38049918.0,P05067,Homo sapiens (Human),,
8qn7,3,#e59e5b,0.0,#e55b5b,Abeta40,Amyloid-beta 40 type 1 filament from the leptomeninges of individual with Alzheimer's disease and cerebral amyloid angiopathy,1-38 (38),9/25/23,ELECTRON MICROSCOPY,2.7,"Yang, Y.; Murzin, A.G.; Peak-Chew, S.; Franco, C.; Garringer, H.J.; Newell, K.L.; Ghetti, B.; Goedert, M.; Scheres, S.H.W.",√,human_ex_vivo,Alzheimer's disease and cerebral amyloid angiopathy,human leptomeninges,P,,EMD-18509,38049918.0,P05067,Homo sapiens (Human),,
8sej,3,#e59e5b,0.0,#e55b5b,Abeta42,Type I beta-amyloid 42 Filaments from Down syndrome,9-42 (34),4/10/23,ELECTRON MICROSCOPY,3.17,"Fernandez, A.; Hoq, M.R.; Hallinan, G.I.; Li, D.; Bharath, S.R.; Vago, F.S.; Zhang, X.; Ozcan, K.A.; Newell, K.L.; Garringer, H.J.; Jiang, W.; Ghetti, B.; Vidal, R.",√,human_ex_vivo,Alzheimer's disease in Down syndrome,human temporal cortex,P,,EMD-40416,38553642.0,P05067,Homo sapiens (Human),,
8sek,3,#e59e5b,0.0,#e55b5b,Abeta40,Type IIIa beta-amyloid 40 Filaments from Down syndrome,9-40 (32),4/10/23,ELECTRON MICROSCOPY,3.5,"Fernandez, A.; Hoq, M.R.; Hallinan, G.I.; Li, D.; Bharath, S.R.; Vago, F.S.; Zhang, X.; Ozcan, K.A.; Newell, K.L.; Garringer, H.J.; Jiang, W.; Ghetti, B.; Vidal, R.",√,human_ex_vivo,Down syndrome,"human brain (temporal cortex, Down syndrome case 2)",P,,EMD-40419,38553642.0,P05067,Homo sapiens (Human),,
8sel,3,#e59e5b,0.0,#e55b5b,Abeta40,Type IIIb beta-amyloid 40 Filaments from Down Syndrome,8-40 (33),4/10/23,ELECTRON MICROSCOPY,3.8,"Fernandez, A.; Hoq, M.R.; Hallinan, G.I.; Li, D.; Bharath, S.R.; Vago, F.S.; Zhang, X.; Ozcan, K.A.; Newell, K.L.; Garringer, H.J.; Jiang, W.; Ghetti, B.; Vidal, R.",√,human_ex_vivo,Alzheimer's disease,human temporal cortex,P,,EMD-40421,38553642.0,P05067,Homo sapiens (Human),,
8teq,3,#e59e5b,0.0,#e55b5b,TFG,"Tropomyosin-receptor kinase fused gene protein (TRK-fused gene protein; TFG) Low Complexity Domain (residues 237-327) G269V mutant, amyloid fiber",262-290 (29),7/6/23,ELECTRON MICROSCOPY,2.84,"Rosenberg, G.M.; Abskharon, R.; Boyer, D.R.; Ge, P.; Sawaya, M.R.; Eisenberg, D.S.",,in_vitro,,,P,,EMD-41195,38077690.0,Q92734,Homo sapiens (Human),G269V,
8v1n,3,#e59e5b,4.0,#e5ac5b,Tau,Cryo-EM structure of tau filaments made from jR2R3-P301L peptides induced with heparin,295-311 (17),11/20/23,ELECTRON MICROSCOPY,3.0,"Vigers, M.P.; Lobo, S.; Najafi, S.; Dubose, A.; Tsay, K.; Ganguly, P.; Longhini, A.P.; Jin, Y.; Buratto, S.K.; Kosik, K.S.; Shell, M.S.; Shea, J.E.; Han, S.",,in_vitro,,,P,,EMD-42886,40294272.0,P10636,Homo sapiens (Human),P301L,
9ck6,3,#e59e5b,0.0,#e55b5b,Abeta42,Cryo-EM structure of sarkosyl insoluble amyloid-beta 42 filaments extracted from human brain tissue,9-42 (34),7/8/24,ELECTRON MICROSCOPY,3.0,"Butan, C.; Strittmatter, S.",√,human_ex_vivo,,human brain tissue,P,,EMD-45642,,P05067,Homo sapiens (Human),,
9cki,3,#e59e5b,0.0,#e55b5b,Abeta42,Cryo-EM structure of the poly(4-styrenesulfonic acid-co-maleic acid) [PSCMA]-extractable amyloid-beta 42 oligomer from human brain tissue (Conformation 2),9-42 (34),7/9/24,ELECTRON MICROSCOPY,3.1,"Butan, C.; Strittmatter, S.",√,human_ex_vivo,,human brain tissue,P,,EMD-45647,,P05067,Homo sapiens (Human),,
9co4,3,#e59e5b,0.0,#e55b5b,Abeta42,Cryo-EM structure of the receptor-bound amyloid-beta 42 oligomer from human brain tissue (Conformation 1),9-42 (34),7/16/24,ELECTRON MICROSCOPY,2.8,"Butan, C.; Strittmatter, S.",√,human_ex_vivo,,human brain tissue,P,,EMD-45770,,P05067,Homo sapiens (Human),,
9czn,3,#e59e5b,0.0,#e55b5b,Abeta42,Type Ic amyloid-beta 42 filaments in dominantly inherited Alzheimer disease with cotton wool plaques,9-42 (34),8/5/24,ELECTRON MICROSCOPY,2.6,"Hoq, M.R.; Fernandez, A.; Vago, F.S.; Hallinan, G.I.; Bharath, S.R.; Li, D.; Ozcan, K.A.; Garringer, H.J.; Jiang, W.; Vidal, R.; Ghetti, B.",√,human_ex_vivo,Alzheimer's disease,human cerebral cortex,P,,EMD-46422,39147931.0,P05067,Homo sapiens (Human),,
9czp,3,#e59e5b,0.0,#e55b5b,Abeta42,Type Id amyloid-beta 42 filaments in dominantly inherited Alzheimer disease with cotton wool plaques,9-42 (34),8/5/24,ELECTRON MICROSCOPY,3.3,"Hoq, M.R.; Fernandez, A.; Vago, F.S.; Hallinan, G.I.; Bharath, S.R.; Li, D.; Ozcan, K.A.; Garringer, H.J.; Jiang, W.; Vidal, R.; Ghetti, B.",√,human_ex_vivo,Alzheimer's disease,"human cerebral cortex (DIAD, PSEN1 V261I and A431E)",P,,EMD-46424,39147931.0,P05067,Homo sapiens (Human),,
9fh1,3,#e59e5b,0.0,#e55b5b,Abeta42,Cryo-EM Structure of Amyloid-beta Fibrils from Mouse Brain Carrying the Uppsala AbetaUpp(1-42)delta(19-24) Mutation,8-18; 25-42 (28),5/26/24,ELECTRON MICROSCOPY,3.2,"Zielinski, M.; Peralta Reyes, F.S.; Gremer, L.; Sommerhage, S.; Pagnon de la Vega, M.; Roder, C.; Heidler, T.V.; Syvanen, S.; Willbold, D.; Sehlin, D.; Ingelsson, M.; Schroder, G.F.",,animal_ex_vivo,,tg-UppSwe mouse brain,P,,EMD-50436,41044681.0,P05067,Homo sapiens (Human),,d19-24
9fh2,3,#e59e5b,-1.0,#7f7f7f,Abeta42,Cryo-EM Structure of Amyloid-beta Fibrils Carrying the Uppsala AbetaUpp(1-42)delta(19-24) Mutation - Polymorph 1,9-18; 25-42 (28),5/26/24,ELECTRON MICROSCOPY,3.7,"Zielinski, M.; Peralta Reyes, F.S.; Gremer, L.; Sommerhage, S.; Pagnon de la Vega, M.; Roder, C.; Heidler, T.V.; Syvanen, S.; Willbold, D.; Sehlin, D.; Ingelsson, M.; Schroder, G.F.",,in_vitro,,,P,,EMD-50437,41044681.0,P05067,Homo sapiens (Human),,d19-24
9fh3,3,#e59e5b,4.0,#e5ac5b,Abeta42,Cryo-EM Structure of Amyloid-beta Fibrils Carrying the Uppsala AbetaUpp(1-42)delta(19-24) Mutation - Polymorph 2,9-18; 25-42 (28),5/26/24,ELECTRON MICROSCOPY,3.9,"Zielinski, M.; Peralta Reyes, F.S.; Gremer, L.; Sommerhage, S.; Pagnon de la Vega, M.; Roder, C.; Heidler, T.V.; Syvanen, S.; Willbold, D.; Sehlin, D.; Ingelsson, M.; Schroder, G.F.",,in_vitro,,,P,,EMD-50438,41044681.0,P05067,Homo sapiens (Human),,d19-24
